product_id,product_name,description,category,price,quantity,brand,color,weight,dimensions
759,aliquam erat volutpat in congue etiam justo etiam pretium iaculis justo in hac habitasse platea dictumst etiam faucibus,"In hac habitasse platea dictumst. Aliquam augue quam, sollicitudin vitae, consectetuer eget, rutrum at, lorem. Integer tincidunt ante vel ipsum.",electronics,33.11,43,Oyonder,Maroon,63.96,ante ipsum primis in faucibus orci luctus et ultrices posuere cubilia curae duis faucibus accumsan odio curabitur
760,arcu adipiscing molestie hendrerit at vulputate vitae nisl aenean lectus pellentesque,"Praesent lectus. Vestibulum quam sapien, varius ut, blandit non, interdum in, ante. Vestibulum ante ipsum primis in faucibus orci luctus et ultrices posuere cubilia Curae; Duis faucibus accumsan odio. Curabitur convallis. Duis consequat dui nec nisi volutpat eleifend. Donec ut dolor. Morbi vel lectus in quam fringilla rhoncus. Mauris enim leo, rhoncus sed, vestibulum sit amet, cursus id, turpis. Integer aliquet, massa id lobortis convallis, tortor risus dapibus augue, vel accumsan tellus nisi eu orci.",electronics,820.29,376,Muxo,Red,74.44,blandit mi in porttitor pede justo eu massa donec dapibus duis at velit eu est congue elementum
761,ipsum dolor sit amet consectetuer adipiscing elit proin risus praesent lectus vestibulum quam sapien varius ut blandit non,"Vivamus in felis eu sapien cursus vestibulum. Proin eu mi. Nulla ac enim. In tempor, turpis nec euismod scelerisque, quam turpis adipiscing lorem, vitae mattis nibh ligula nec sem. Duis aliquam convallis nunc. Proin at turpis a pede posuere nonummy. Integer non velit.",home goods,405.74,884,Gabspot,Turquoise,93.26,etiam faucibus cursus urna ut tellus nulla ut erat id mauris vulputate
762,ac consequat metus sapien ut nunc vestibulum ante ipsum primis in faucibus orci luctus et ultrices posuere cubilia curae mauris,In congue. Etiam justo. Etiam pretium iaculis justo. In hac habitasse platea dictumst. Etiam faucibus cursus urna. Ut tellus. Nulla ut erat id mauris vulputate elementum.,clothing,709.9,305,DabZ,Violet,40.95,proin interdum mauris non ligula pellentesque ultrices phasellus id sapien in sapien iaculis congue vivamus metus
763,risus dapibus augue vel accumsan tellus nisi eu orci mauris lacinia sapien,Integer ac neque. Duis bibendum.,toys,167.91,459,Zoomdog,Aquamarine,83.38,erat curabitur gravida nisi at nibh in hac habitasse platea dictumst aliquam augue quam sollicitudin vitae
764,orci vehicula condimentum curabitur in libero ut massa volutpat convallis morbi odio odio elementum eu,Nulla justo. Aliquam quis turpis eget elit sodales scelerisque. Mauris sit amet eros. Suspendisse accumsan tortor quis turpis. Sed ante. Vivamus tortor. Duis mattis egestas metus. Aenean fermentum.,toys,305.79,843,Photobug,Puce,99.72,ac diam cras pellentesque volutpat dui maecenas tristique est et tempus semper est quam pharetra
765,iaculis justo in hac habitasse platea dictumst etiam faucibus cursus urna ut tellus nulla ut erat,"Integer aliquet, massa id lobortis convallis, tortor risus dapibus augue, vel accumsan tellus nisi eu orci.",beauty,181.92,215,Yakitri,Fuscia,59.4,quis turpis eget elit sodales scelerisque mauris sit amet eros suspendisse accumsan tortor quis turpis sed ante vivamus
766,tortor sollicitudin mi sit amet lobortis sapien sapien non mi integer ac neque duis bibendum morbi non quam nec dui,Mauris lacinia sapien quis libero. Nullam sit amet turpis elementum ligula vehicula consequat. Morbi a ipsum. Integer a nibh. In quis justo.,electronics,249.06,771,Jabberstorm,Crimson,68.97,non mi integer ac neque duis bibendum morbi non quam nec
767,interdum venenatis turpis enim blandit mi in porttitor pede justo eu massa donec dapibus duis at,"In quis justo. Maecenas rhoncus aliquam lacus. Morbi quis tortor id nulla ultrices aliquet. Maecenas leo odio, condimentum id, luctus nec, molestie sed, justo. Pellentesque viverra pede ac diam. Cras pellentesque volutpat dui. Maecenas tristique, est et tempus semper, est quam pharetra magna, ac consequat metus sapien ut nunc.",clothing,378.21,331,Ailane,Maroon,24.75,diam cras pellentesque volutpat dui maecenas tristique est et tempus semper est quam pharetra
768,tincidunt lacus at velit vivamus vel nulla eget eros elementum pellentesque quisque porta volutpat erat quisque erat eros viverra,In sagittis dui vel nisl.,electronics,754.31,277,Skinte,Blue,40.38,tincidunt nulla mollis molestie lorem quisque ut erat curabitur gravida nisi at nibh in hac habitasse
769,in leo maecenas pulvinar lobortis est phasellus sit amet erat nulla tempus vivamus in felis eu sapien cursus vestibulum,"Mauris ullamcorper purus sit amet nulla. Quisque arcu libero, rutrum ac, lobortis vel, dapibus at, diam. Nam tristique tortor eu pede.",clothing,216.7,359,Ailane,Puce,43.51,velit vivamus vel nulla eget eros elementum pellentesque quisque porta volutpat erat quisque erat eros viverra eget
770,suscipit a feugiat et eros vestibulum ac est lacinia nisi venenatis,"Cum sociis natoque penatibus et magnis dis parturient montes, nascetur ridiculus mus. Vivamus vestibulum sagittis sapien. Cum sociis natoque penatibus et magnis dis parturient montes, nascetur ridiculus mus. Etiam vel augue. Vestibulum rutrum rutrum neque. Aenean auctor gravida sem. Praesent id massa id nisl venenatis lacinia. Aenean sit amet justo. Morbi ut odio.",home goods,249.75,659,JumpXS,Green,5.62,suscipit nulla elit ac nulla sed vel enim sit amet nunc viverra dapibus
771,sociis natoque penatibus et magnis dis parturient montes nascetur ridiculus mus etiam vel augue vestibulum rutrum rutrum neque,Morbi porttitor lorem id ligula. Suspendisse ornare consequat lectus.,beauty,88.69,475,Eimbee,Indigo,55.24,etiam vel augue vestibulum rutrum rutrum neque aenean auctor gravida sem praesent id massa
772,vivamus vestibulum sagittis sapien cum sociis natoque penatibus et magnis dis parturient montes nascetur ridiculus mus etiam vel,"Aenean fermentum. Donec ut mauris eget massa tempor convallis. Nulla neque libero, convallis eget, eleifend luctus, ultricies eu, nibh.",beauty,592.09,257,Gabvine,Pink,64.69,sapien cum sociis natoque penatibus et magnis dis parturient montes nascetur ridiculus mus etiam vel
773,est quam pharetra magna ac consequat metus sapien ut nunc vestibulum,Sed vel enim sit amet nunc viverra dapibus. Nulla suscipit ligula in lacus.,clothing,518.92,729,Gabcube,Orange,73.52,duis at velit eu est congue elementum in hac habitasse platea
774,ut rhoncus aliquet pulvinar sed nisl nunc rhoncus dui vel sem,"Vestibulum ac est lacinia nisi venenatis tristique. Fusce congue, diam id ornare imperdiet, sapien urna pretium nisl, ut volutpat sapien arcu sed augue. Aliquam erat volutpat.",electronics,464.8,907,Yoveo,Red,40.84,interdum in ante vestibulum ante ipsum primis in faucibus orci luctus et ultrices posuere cubilia curae duis
775,tellus semper interdum mauris ullamcorper purus sit amet nulla quisque arcu libero rutrum ac lobortis vel dapibus at,"Morbi vestibulum, velit id pretium iaculis, diam erat fermentum justo, nec condimentum neque sapien placerat ante. Nulla justo. Aliquam quis turpis eget elit sodales scelerisque. Mauris sit amet eros. Suspendisse accumsan tortor quis turpis. Sed ante. Vivamus tortor.",toys,8.25,297,Trunyx,Red,5.43,pharetra magna vestibulum aliquet ultrices erat tortor sollicitudin mi sit amet
776,platea dictumst aliquam augue quam sollicitudin vitae consectetuer eget rutrum at lorem integer tincidunt ante vel ipsum,"Vestibulum ac est lacinia nisi venenatis tristique. Fusce congue, diam id ornare imperdiet, sapien urna pretium nisl, ut volutpat sapien arcu sed augue. Aliquam erat volutpat. In congue. Etiam justo. Etiam pretium iaculis justo. In hac habitasse platea dictumst. Etiam faucibus cursus urna. Ut tellus.",clothing,894.99,615,Oyoyo,Red,76.9,id consequat in consequat ut nulla sed accumsan felis ut at dolor
777,vel pede morbi porttitor lorem id ligula suspendisse ornare consequat lectus in est risus,"Pellentesque viverra pede ac diam. Cras pellentesque volutpat dui. Maecenas tristique, est et tempus semper, est quam pharetra magna, ac consequat metus sapien ut nunc. Vestibulum ante ipsum primis in faucibus orci luctus et ultrices posuere cubilia Curae; Mauris viverra diam vitae quam.",electronics,659.03,123,Quatz,Violet,56.69,nunc commodo placerat praesent blandit nam nulla integer pede justo lacinia eget tincidunt eget tempus vel
778,eget congue eget semper rutrum nulla nunc purus phasellus in felis,"In tempor, turpis nec euismod scelerisque, quam turpis adipiscing lorem, vitae mattis nibh ligula nec sem. Duis aliquam convallis nunc. Proin at turpis a pede posuere nonummy. Integer non velit. Donec diam neque, vestibulum eget, vulputate ut, ultrices vel, augue. Vestibulum ante ipsum primis in faucibus orci luctus et ultrices posuere cubilia Curae; Donec pharetra, magna vestibulum aliquet ultrices, erat tortor sollicitudin mi, sit amet lobortis sapien sapien non mi.",electronics,771.33,406,Linklinks,Puce,84.61,vestibulum sed magna at nunc commodo placerat praesent blandit nam nulla integer
779,erat id mauris vulputate elementum nullam varius nulla facilisi cras non velit nec nisi vulputate nonummy maecenas tincidunt,"Proin risus. Praesent lectus. Vestibulum quam sapien, varius ut, blandit non, interdum in, ante. Vestibulum ante ipsum primis in faucibus orci luctus et ultrices posuere cubilia Curae; Duis faucibus accumsan odio.",home goods,509.42,942,Browsedrive,Indigo,81.66,sem duis aliquam convallis nunc proin at turpis a pede posuere nonummy integer non velit donec diam neque
780,nisl venenatis lacinia aenean sit amet justo morbi ut odio cras mi pede malesuada in imperdiet et,"Nulla tempus. Vivamus in felis eu sapien cursus vestibulum. Proin eu mi. Nulla ac enim. In tempor, turpis nec euismod scelerisque, quam turpis adipiscing lorem, vitae mattis nibh ligula nec sem. Duis aliquam convallis nunc.",toys,31.79,635,Zoomdog,Red,14.04,nulla quisque arcu libero rutrum ac lobortis vel dapibus at diam
781,libero non mattis pulvinar nulla pede ullamcorper augue a suscipit nulla elit ac,Praesent blandit lacinia erat. Vestibulum sed magna at nunc commodo placerat. Praesent blandit.,clothing,724.27,328,Tazzy,Mauv,61.01,sit amet sapien dignissim vestibulum vestibulum ante ipsum primis in faucibus orci luctus et ultrices posuere cubilia curae
782,faucibus orci luctus et ultrices posuere cubilia curae mauris viverra diam vitae quam suspendisse,"Donec semper sapien a libero. Nam dui. Proin leo odio, porttitor id, consequat in, consequat ut, nulla. Sed accumsan felis. Ut at dolor quis odio consequat varius. Integer ac leo. Pellentesque ultrices mattis odio. Donec vitae nisi. Nam ultrices, libero non mattis pulvinar, nulla pede ullamcorper augue, a suscipit nulla elit ac nulla.",home goods,800.06,755,Trilith,Purple,5.96,felis sed lacus morbi sem mauris laoreet ut rhoncus aliquet pulvinar sed nisl
783,eget massa tempor convallis nulla neque libero convallis eget eleifend luctus ultricies eu nibh quisque id justo,Proin risus.,toys,155.23,185,Npath,Teal,0.96,velit eu est congue elementum in hac habitasse platea dictumst morbi vestibulum velit id pretium iaculis diam erat fermentum
784,platea dictumst maecenas ut massa quis augue luctus tincidunt nulla mollis molestie lorem quisque ut erat,"In hac habitasse platea dictumst. Aliquam augue quam, sollicitudin vitae, consectetuer eget, rutrum at, lorem.",clothing,442.17,2,Oba,Blue,37.48,vestibulum ante ipsum primis in faucibus orci luctus et ultrices posuere cubilia curae
785,vel nulla eget eros elementum pellentesque quisque porta volutpat erat quisque erat eros viverra eget congue eget semper rutrum,"In est risus, auctor sed, tristique in, tempus sit amet, sem. Fusce consequat. Nulla nisl. Nunc nisl. Duis bibendum, felis sed interdum venenatis, turpis enim blandit mi, in porttitor pede justo eu massa. Donec dapibus. Duis at velit eu est congue elementum. In hac habitasse platea dictumst. Morbi vestibulum, velit id pretium iaculis, diam erat fermentum justo, nec condimentum neque sapien placerat ante.",home goods,266.67,40,Gigazoom,Orange,80.52,quis justo maecenas rhoncus aliquam lacus morbi quis tortor id
786,aliquam non mauris morbi non lectus aliquam sit amet diam in magna bibendum imperdiet nullam orci pede,"Cum sociis natoque penatibus et magnis dis parturient montes, nascetur ridiculus mus. Etiam vel augue. Vestibulum rutrum rutrum neque. Aenean auctor gravida sem.",home goods,667.33,313,Realbridge,Purple,51.12,pulvinar nulla pede ullamcorper augue a suscipit nulla elit ac nulla sed vel enim sit amet
787,nec nisi vulputate nonummy maecenas tincidunt lacus at velit vivamus vel nulla eget eros elementum pellentesque quisque,"Aenean lectus. Pellentesque eget nunc. Donec quis orci eget orci vehicula condimentum. Curabitur in libero ut massa volutpat convallis. Morbi odio odio, elementum eu, interdum eu, tincidunt in, leo.",clothing,632.87,858,Mynte,Violet,75.11,at vulputate vitae nisl aenean lectus pellentesque eget nunc donec quis orci eget orci vehicula condimentum
788,ut rhoncus aliquet pulvinar sed nisl nunc rhoncus dui vel sem sed sagittis nam congue risus semper porta,"Integer non velit. Donec diam neque, vestibulum eget, vulputate ut, ultrices vel, augue. Vestibulum ante ipsum primis in faucibus orci luctus et ultrices posuere cubilia Curae; Donec pharetra, magna vestibulum aliquet ultrices, erat tortor sollicitudin mi, sit amet lobortis sapien sapien non mi. Integer ac neque. Duis bibendum.",home goods,98.64,373,Eamia,Orange,88.47,posuere cubilia curae nulla dapibus dolor vel est donec odio justo sollicitudin ut suscipit a feugiat
789,volutpat in congue etiam justo etiam pretium iaculis justo in hac habitasse platea dictumst etiam faucibus cursus urna ut tellus,"Sed accumsan felis. Ut at dolor quis odio consequat varius. Integer ac leo. Pellentesque ultrices mattis odio. Donec vitae nisi. Nam ultrices, libero non mattis pulvinar, nulla pede ullamcorper augue, a suscipit nulla elit ac nulla. Sed vel enim sit amet nunc viverra dapibus. Nulla suscipit ligula in lacus. Curabitur at ipsum ac tellus semper interdum.",electronics,217.13,433,Meembee,Purple,79.68,massa quis augue luctus tincidunt nulla mollis molestie lorem quisque ut erat curabitur
790,natoque penatibus et magnis dis parturient montes nascetur ridiculus mus vivamus vestibulum sagittis sapien,"Donec quis orci eget orci vehicula condimentum. Curabitur in libero ut massa volutpat convallis. Morbi odio odio, elementum eu, interdum eu, tincidunt in, leo. Maecenas pulvinar lobortis est. Phasellus sit amet erat. Nulla tempus. Vivamus in felis eu sapien cursus vestibulum.",clothing,970.7,410,Skilith,Teal,47.12,rutrum nulla tellus in sagittis dui vel nisl duis ac nibh fusce lacus purus aliquet at
791,nibh in hac habitasse platea dictumst aliquam augue quam sollicitudin vitae consectetuer eget rutrum at lorem integer tincidunt ante vel,"Vestibulum quam sapien, varius ut, blandit non, interdum in, ante. Vestibulum ante ipsum primis in faucibus orci luctus et ultrices posuere cubilia Curae; Duis faucibus accumsan odio. Curabitur convallis. Duis consequat dui nec nisi volutpat eleifend. Donec ut dolor. Morbi vel lectus in quam fringilla rhoncus. Mauris enim leo, rhoncus sed, vestibulum sit amet, cursus id, turpis.",electronics,785.34,848,Babbleblab,Crimson,59.01,odio condimentum id luctus nec molestie sed justo pellentesque viverra pede ac diam cras pellentesque volutpat dui maecenas
792,aliquam sit amet diam in magna bibendum imperdiet nullam orci,Etiam pretium iaculis justo. In hac habitasse platea dictumst. Etiam faucibus cursus urna. Ut tellus.,clothing,931.92,238,Browsetype,Turquoise,85.69,magnis dis parturient montes nascetur ridiculus mus vivamus vestibulum sagittis sapien cum sociis natoque penatibus et
793,sagittis sapien cum sociis natoque penatibus et magnis dis parturient montes nascetur ridiculus mus etiam vel augue vestibulum rutrum,Mauris sit amet eros. Suspendisse accumsan tortor quis turpis. Sed ante. Vivamus tortor.,electronics,809.23,675,Voolith,Khaki,14.02,consequat ut nulla sed accumsan felis ut at dolor quis odio consequat varius integer ac leo
794,in ante vestibulum ante ipsum primis in faucibus orci luctus et ultrices posuere cubilia,"Cum sociis natoque penatibus et magnis dis parturient montes, nascetur ridiculus mus. Vivamus vestibulum sagittis sapien. Cum sociis natoque penatibus et magnis dis parturient montes, nascetur ridiculus mus. Etiam vel augue.",toys,44.8,618,Buzzshare,Violet,42.62,sed lacus morbi sem mauris laoreet ut rhoncus aliquet pulvinar sed nisl nunc rhoncus dui vel sem
795,orci luctus et ultrices posuere cubilia curae donec pharetra magna vestibulum aliquet ultrices erat tortor sollicitudin mi sit,"Nulla mollis molestie lorem. Quisque ut erat. Curabitur gravida nisi at nibh. In hac habitasse platea dictumst. Aliquam augue quam, sollicitudin vitae, consectetuer eget, rutrum at, lorem. Integer tincidunt ante vel ipsum. Praesent blandit lacinia erat.",beauty,967.74,21,Avamm,Orange,27.59,suspendisse ornare consequat lectus in est risus auctor sed tristique
796,ut ultrices vel augue vestibulum ante ipsum primis in faucibus orci luctus et ultrices posuere cubilia curae,"Fusce congue, diam id ornare imperdiet, sapien urna pretium nisl, ut volutpat sapien arcu sed augue. Aliquam erat volutpat. In congue. Etiam justo. Etiam pretium iaculis justo. In hac habitasse platea dictumst. Etiam faucibus cursus urna. Ut tellus. Nulla ut erat id mauris vulputate elementum.",electronics,579.75,218,Meezzy,Blue,59.84,nullam molestie nibh in lectus pellentesque at nulla suspendisse potenti cras in purus eu magna
797,suscipit ligula in lacus curabitur at ipsum ac tellus semper interdum mauris ullamcorper purus sit amet,"Maecenas tincidunt lacus at velit. Vivamus vel nulla eget eros elementum pellentesque. Quisque porta volutpat erat. Quisque erat eros, viverra eget, congue eget, semper rutrum, nulla. Nunc purus. Phasellus in felis. Donec semper sapien a libero. Nam dui. Proin leo odio, porttitor id, consequat in, consequat ut, nulla. Sed accumsan felis.",electronics,411.09,693,Zooveo,Violet,22.42,lectus pellentesque eget nunc donec quis orci eget orci vehicula
798,molestie lorem quisque ut erat curabitur gravida nisi at nibh in hac habitasse,"Pellentesque ultrices mattis odio. Donec vitae nisi. Nam ultrices, libero non mattis pulvinar, nulla pede ullamcorper augue, a suscipit nulla elit ac nulla. Sed vel enim sit amet nunc viverra dapibus. Nulla suscipit ligula in lacus. Curabitur at ipsum ac tellus semper interdum. Mauris ullamcorper purus sit amet nulla. Quisque arcu libero, rutrum ac, lobortis vel, dapibus at, diam. Nam tristique tortor eu pede.",toys,714.74,181,Dynabox,Blue,61.71,adipiscing elit proin interdum mauris non ligula pellentesque ultrices phasellus id sapien in sapien iaculis congue vivamus metus arcu
799,cras pellentesque volutpat dui maecenas tristique est et tempus semper est quam pharetra magna ac consequat metus sapien ut,"Pellentesque viverra pede ac diam. Cras pellentesque volutpat dui. Maecenas tristique, est et tempus semper, est quam pharetra magna, ac consequat metus sapien ut nunc. Vestibulum ante ipsum primis in faucibus orci luctus et ultrices posuere cubilia Curae; Mauris viverra diam vitae quam. Suspendisse potenti. Nullam porttitor lacus at turpis. Donec posuere metus vitae ipsum. Aliquam non mauris. Morbi non lectus. Aliquam sit amet diam in magna bibendum imperdiet.",home goods,371.01,745,Quatz,Purple,46.29,est risus auctor sed tristique in tempus sit amet sem fusce consequat nulla nisl
800,vestibulum aliquet ultrices erat tortor sollicitudin mi sit amet lobortis sapien sapien non,"Nunc nisl. Duis bibendum, felis sed interdum venenatis, turpis enim blandit mi, in porttitor pede justo eu massa. Donec dapibus. Duis at velit eu est congue elementum. In hac habitasse platea dictumst. Morbi vestibulum, velit id pretium iaculis, diam erat fermentum justo, nec condimentum neque sapien placerat ante. Nulla justo. Aliquam quis turpis eget elit sodales scelerisque. Mauris sit amet eros.",beauty,12.04,412,Vitz,Red,37.79,vitae ipsum aliquam non mauris morbi non lectus aliquam sit amet diam in magna
801,odio porttitor id consequat in consequat ut nulla sed accumsan,Ut tellus. Nulla ut erat id mauris vulputate elementum.,beauty,123.02,243,Thoughtbeat,Puce,38.08,vivamus tortor duis mattis egestas metus aenean fermentum donec ut mauris
802,sagittis sapien cum sociis natoque penatibus et magnis dis parturient montes nascetur ridiculus,"Integer a nibh. In quis justo. Maecenas rhoncus aliquam lacus. Morbi quis tortor id nulla ultrices aliquet. Maecenas leo odio, condimentum id, luctus nec, molestie sed, justo. Pellentesque viverra pede ac diam. Cras pellentesque volutpat dui.",home goods,995.57,474,Tagtune,Red,12.0,cursus urna ut tellus nulla ut erat id mauris vulputate elementum nullam varius nulla facilisi cras non velit nec nisi
803,convallis nulla neque libero convallis eget eleifend luctus ultricies eu nibh quisque id justo sit amet sapien dignissim,"Maecenas leo odio, condimentum id, luctus nec, molestie sed, justo. Pellentesque viverra pede ac diam. Cras pellentesque volutpat dui. Maecenas tristique, est et tempus semper, est quam pharetra magna, ac consequat metus sapien ut nunc. Vestibulum ante ipsum primis in faucibus orci luctus et ultrices posuere cubilia Curae; Mauris viverra diam vitae quam. Suspendisse potenti. Nullam porttitor lacus at turpis. Donec posuere metus vitae ipsum. Aliquam non mauris.",beauty,369.46,556,Trunyx,Orange,17.92,aliquet ultrices erat tortor sollicitudin mi sit amet lobortis sapien sapien non mi integer ac neque
804,libero quis orci nullam molestie nibh in lectus pellentesque at nulla suspendisse potenti cras in purus eu magna vulputate luctus,"Phasellus in felis. Donec semper sapien a libero. Nam dui. Proin leo odio, porttitor id, consequat in, consequat ut, nulla. Sed accumsan felis. Ut at dolor quis odio consequat varius.",electronics,846.39,692,Riffwire,Red,24.39,nec molestie sed justo pellentesque viverra pede ac diam cras pellentesque volutpat dui maecenas tristique
805,quis tortor id nulla ultrices aliquet maecenas leo odio condimentum id luctus nec molestie sed justo pellentesque viverra,"Mauris ullamcorper purus sit amet nulla. Quisque arcu libero, rutrum ac, lobortis vel, dapibus at, diam.",beauty,392.87,982,Aimbo,Purple,55.96,sapien cum sociis natoque penatibus et magnis dis parturient montes nascetur ridiculus
806,velit eu est congue elementum in hac habitasse platea dictumst morbi vestibulum,"Cum sociis natoque penatibus et magnis dis parturient montes, nascetur ridiculus mus. Etiam vel augue. Vestibulum rutrum rutrum neque. Aenean auctor gravida sem.",clothing,621.53,892,Oyoyo,Red,58.81,donec pharetra magna vestibulum aliquet ultrices erat tortor sollicitudin mi
807,ridiculus mus vivamus vestibulum sagittis sapien cum sociis natoque penatibus et magnis dis parturient montes nascetur ridiculus mus,Nulla ut erat id mauris vulputate elementum. Nullam varius.,toys,680.76,533,Gigazoom,Violet,73.58,maecenas ut massa quis augue luctus tincidunt nulla mollis molestie lorem quisque ut erat
808,placerat praesent blandit nam nulla integer pede justo lacinia eget tincidunt eget tempus vel pede,"Morbi vel lectus in quam fringilla rhoncus. Mauris enim leo, rhoncus sed, vestibulum sit amet, cursus id, turpis.",electronics,34.5,677,Skipfire,Teal,26.56,sit amet nunc viverra dapibus nulla suscipit ligula in lacus curabitur at ipsum ac
809,ullamcorper purus sit amet nulla quisque arcu libero rutrum ac lobortis vel dapibus,Etiam vel augue. Vestibulum rutrum rutrum neque. Aenean auctor gravida sem. Praesent id massa id nisl venenatis lacinia.,beauty,534.3,542,Leexo,Yellow,2.97,ac est lacinia nisi venenatis tristique fusce congue diam id ornare imperdiet sapien urna pretium nisl ut volutpat sapien
810,felis fusce posuere felis sed lacus morbi sem mauris laoreet ut rhoncus aliquet pulvinar sed nisl,"Nam dui. Proin leo odio, porttitor id, consequat in, consequat ut, nulla. Sed accumsan felis. Ut at dolor quis odio consequat varius. Integer ac leo. Pellentesque ultrices mattis odio.",toys,653.84,22,Voolia,Blue,76.33,dolor morbi vel lectus in quam fringilla rhoncus mauris enim leo rhoncus sed
811,est risus auctor sed tristique in tempus sit amet sem fusce consequat nulla nisl nunc,"Mauris enim leo, rhoncus sed, vestibulum sit amet, cursus id, turpis. Integer aliquet, massa id lobortis convallis, tortor risus dapibus augue, vel accumsan tellus nisi eu orci. Mauris lacinia sapien quis libero.",home goods,165.86,228,Browsedrive,Crimson,94.06,dolor quis odio consequat varius integer ac leo pellentesque ultrices mattis odio donec vitae nisi nam ultrices libero
812,viverra pede ac diam cras pellentesque volutpat dui maecenas tristique est et tempus semper est quam,"Nullam orci pede, venenatis non, sodales sed, tincidunt eu, felis. Fusce posuere felis sed lacus. Morbi sem mauris, laoreet ut, rhoncus aliquet, pulvinar sed, nisl.",clothing,125.63,593,Kanoodle,Goldenrod,69.0,aliquet massa id lobortis convallis tortor risus dapibus augue vel accumsan tellus nisi eu orci mauris lacinia sapien quis libero
813,donec vitae nisi nam ultrices libero non mattis pulvinar nulla,"Donec ut dolor. Morbi vel lectus in quam fringilla rhoncus. Mauris enim leo, rhoncus sed, vestibulum sit amet, cursus id, turpis. Integer aliquet, massa id lobortis convallis, tortor risus dapibus augue, vel accumsan tellus nisi eu orci.",toys,708.22,104,Flashpoint,Yellow,21.27,vestibulum sed magna at nunc commodo placerat praesent blandit nam nulla integer pede
