product_id,product_name,description,category,price,quantity,brand,color,weight,dimensions
487,cubilia curae donec pharetra magna vestibulum aliquet ultrices erat tortor sollicitudin mi sit amet lobortis sapien sapien non mi integer,Etiam faucibus cursus urna. Ut tellus. Nulla ut erat id mauris vulputate elementum. Nullam varius. Nulla facilisi. Cras non velit nec nisi vulputate nonummy. Maecenas tincidunt lacus at velit. Vivamus vel nulla eget eros elementum pellentesque. Quisque porta volutpat erat.,toys,844.33,402,Vinte,Aquamarine,51.32,sollicitudin ut suscipit a feugiat et eros vestibulum ac est lacinia
488,vestibulum ante ipsum primis in faucibus orci luctus et ultrices posuere,"Nulla nisl. Nunc nisl. Duis bibendum, felis sed interdum venenatis, turpis enim blandit mi, in porttitor pede justo eu massa. Donec dapibus. Duis at velit eu est congue elementum. In hac habitasse platea dictumst.",clothing,437.51,122,Tagcat,Red,96.83,nullam orci pede venenatis non sodales sed tincidunt eu felis fusce posuere felis
489,dis parturient montes nascetur ridiculus mus etiam vel augue vestibulum rutrum rutrum neque aenean auctor gravida sem,"Pellentesque ultrices mattis odio. Donec vitae nisi. Nam ultrices, libero non mattis pulvinar, nulla pede ullamcorper augue, a suscipit nulla elit ac nulla. Sed vel enim sit amet nunc viverra dapibus. Nulla suscipit ligula in lacus. Curabitur at ipsum ac tellus semper interdum. Mauris ullamcorper purus sit amet nulla.",electronics,550.18,491,Camimbo,Khaki,26.13,massa id nisl venenatis lacinia aenean sit amet justo morbi ut
490,proin at turpis a pede posuere nonummy integer non velit donec diam neque vestibulum,"Cum sociis natoque penatibus et magnis dis parturient montes, nascetur ridiculus mus. Etiam vel augue. Vestibulum rutrum rutrum neque. Aenean auctor gravida sem. Praesent id massa id nisl venenatis lacinia. Aenean sit amet justo. Morbi ut odio. Cras mi pede, malesuada in, imperdiet et, commodo vulputate, justo. In blandit ultrices enim.",clothing,620.44,344,Thoughtworks,Mauv,3.03,dictumst etiam faucibus cursus urna ut tellus nulla ut erat
491,aliquam convallis nunc proin at turpis a pede posuere nonummy integer non velit donec diam neque vestibulum,"Nulla tempus. Vivamus in felis eu sapien cursus vestibulum. Proin eu mi. Nulla ac enim. In tempor, turpis nec euismod scelerisque, quam turpis adipiscing lorem, vitae mattis nibh ligula nec sem. Duis aliquam convallis nunc.",electronics,573.15,129,Edgeclub,Mauv,70.63,morbi porttitor lorem id ligula suspendisse ornare consequat lectus in
492,nullam varius nulla facilisi cras non velit nec nisi vulputate nonummy maecenas tincidunt lacus at velit vivamus vel nulla,"Praesent blandit. Nam nulla. Integer pede justo, lacinia eget, tincidunt eget, tempus vel, pede. Morbi porttitor lorem id ligula. Suspendisse ornare consequat lectus. In est risus, auctor sed, tristique in, tempus sit amet, sem. Fusce consequat. Nulla nisl. Nunc nisl.",toys,818.94,885,Camido,Violet,28.64,nam nulla integer pede justo lacinia eget tincidunt eget tempus
493,vulputate elementum nullam varius nulla facilisi cras non velit nec nisi vulputate nonummy maecenas tincidunt,"Aenean fermentum. Donec ut mauris eget massa tempor convallis. Nulla neque libero, convallis eget, eleifend luctus, ultricies eu, nibh. Quisque id justo sit amet sapien dignissim vestibulum. Vestibulum ante ipsum primis in faucibus orci luctus et ultrices posuere cubilia Curae; Nulla dapibus dolor vel est. Donec odio justo, sollicitudin ut, suscipit a, feugiat et, eros. Vestibulum ac est lacinia nisi venenatis tristique. Fusce congue, diam id ornare imperdiet, sapien urna pretium nisl, ut volutpat sapien arcu sed augue. Aliquam erat volutpat. In congue.",electronics,472.83,349,Tavu,Puce,37.46,magnis dis parturient montes nascetur ridiculus mus etiam vel augue vestibulum rutrum rutrum neque aenean
494,praesent lectus vestibulum quam sapien varius ut blandit non interdum in ante vestibulum ante ipsum primis,"Morbi quis tortor id nulla ultrices aliquet. Maecenas leo odio, condimentum id, luctus nec, molestie sed, justo. Pellentesque viverra pede ac diam. Cras pellentesque volutpat dui.",clothing,442.69,186,Avavee,Maroon,50.13,in felis eu sapien cursus vestibulum proin eu mi nulla ac enim in tempor turpis nec euismod scelerisque
495,auctor sed tristique in tempus sit amet sem fusce consequat nulla nisl nunc nisl duis bibendum felis sed,"Nam ultrices, libero non mattis pulvinar, nulla pede ullamcorper augue, a suscipit nulla elit ac nulla. Sed vel enim sit amet nunc viverra dapibus. Nulla suscipit ligula in lacus. Curabitur at ipsum ac tellus semper interdum. Mauris ullamcorper purus sit amet nulla. Quisque arcu libero, rutrum ac, lobortis vel, dapibus at, diam.",beauty,698.84,423,Devify,Maroon,31.47,turpis donec posuere metus vitae ipsum aliquam non mauris morbi
496,nam dui proin leo odio porttitor id consequat in consequat,"Vestibulum ac est lacinia nisi venenatis tristique. Fusce congue, diam id ornare imperdiet, sapien urna pretium nisl, ut volutpat sapien arcu sed augue. Aliquam erat volutpat. In congue. Etiam justo. Etiam pretium iaculis justo. In hac habitasse platea dictumst. Etiam faucibus cursus urna. Ut tellus.",electronics,640.3,232,Wikizz,Pink,8.77,faucibus accumsan odio curabitur convallis duis consequat dui nec nisi
497,adipiscing elit proin interdum mauris non ligula pellentesque ultrices phasellus id,"Mauris enim leo, rhoncus sed, vestibulum sit amet, cursus id, turpis. Integer aliquet, massa id lobortis convallis, tortor risus dapibus augue, vel accumsan tellus nisi eu orci. Mauris lacinia sapien quis libero. Nullam sit amet turpis elementum ligula vehicula consequat. Morbi a ipsum. Integer a nibh. In quis justo. Maecenas rhoncus aliquam lacus.",home goods,601.0,261,Vidoo,Red,15.57,amet justo morbi ut odio cras mi pede malesuada in imperdiet et commodo
498,eu tincidunt in leo maecenas pulvinar lobortis est phasellus sit amet erat nulla tempus vivamus in felis eu sapien,"Nunc rhoncus dui vel sem. Sed sagittis. Nam congue, risus semper porta volutpat, quam pede lobortis ligula, sit amet eleifend pede libero quis orci. Nullam molestie nibh in lectus. Pellentesque at nulla. Suspendisse potenti. Cras in purus eu magna vulputate luctus. Cum sociis natoque penatibus et magnis dis parturient montes, nascetur ridiculus mus. Vivamus vestibulum sagittis sapien.",electronics,965.94,361,Gigashots,Orange,23.25,tortor duis mattis egestas metus aenean fermentum donec ut mauris eget
499,cum sociis natoque penatibus et magnis dis parturient montes nascetur ridiculus mus vivamus vestibulum sagittis sapien,"Praesent blandit. Nam nulla. Integer pede justo, lacinia eget, tincidunt eget, tempus vel, pede. Morbi porttitor lorem id ligula. Suspendisse ornare consequat lectus. In est risus, auctor sed, tristique in, tempus sit amet, sem. Fusce consequat. Nulla nisl.",home goods,259.59,439,Thoughtbeat,Indigo,75.54,tempor convallis nulla neque libero convallis eget eleifend luctus ultricies
500,in quis justo maecenas rhoncus aliquam lacus morbi quis tortor id nulla ultrices aliquet maecenas leo,"Maecenas leo odio, condimentum id, luctus nec, molestie sed, justo. Pellentesque viverra pede ac diam. Cras pellentesque volutpat dui. Maecenas tristique, est et tempus semper, est quam pharetra magna, ac consequat metus sapien ut nunc. Vestibulum ante ipsum primis in faucibus orci luctus et ultrices posuere cubilia Curae; Mauris viverra diam vitae quam. Suspendisse potenti. Nullam porttitor lacus at turpis. Donec posuere metus vitae ipsum. Aliquam non mauris. Morbi non lectus.",clothing,589.05,191,Twitterbeat,Puce,93.02,adipiscing lorem vitae mattis nibh ligula nec sem duis aliquam convallis nunc proin at
501,tempus semper est quam pharetra magna ac consequat metus sapien ut,In congue. Etiam justo. Etiam pretium iaculis justo. In hac habitasse platea dictumst. Etiam faucibus cursus urna. Ut tellus. Nulla ut erat id mauris vulputate elementum. Nullam varius.,clothing,869.05,759,Agivu,Orange,71.71,pede justo lacinia eget tincidunt eget tempus vel pede morbi
502,sit amet erat nulla tempus vivamus in felis eu sapien cursus vestibulum proin eu mi nulla,"Nam ultrices, libero non mattis pulvinar, nulla pede ullamcorper augue, a suscipit nulla elit ac nulla. Sed vel enim sit amet nunc viverra dapibus. Nulla suscipit ligula in lacus. Curabitur at ipsum ac tellus semper interdum. Mauris ullamcorper purus sit amet nulla.",electronics,858.16,739,Aimbu,Turquoise,3.89,nibh in hac habitasse platea dictumst aliquam augue quam sollicitudin vitae consectetuer eget rutrum at
503,eu massa donec dapibus duis at velit eu est congue elementum in hac habitasse platea dictumst morbi vestibulum velit,"Morbi quis tortor id nulla ultrices aliquet. Maecenas leo odio, condimentum id, luctus nec, molestie sed, justo. Pellentesque viverra pede ac diam.",home goods,558.96,8,Flashspan,Puce,1.99,ipsum integer a nibh in quis justo maecenas rhoncus aliquam lacus morbi quis tortor id
504,habitasse platea dictumst aliquam augue quam sollicitudin vitae consectetuer eget rutrum at lorem integer tincidunt ante vel ipsum,Duis aliquam convallis nunc.,beauty,563.18,821,Browsezoom,Khaki,50.54,sem mauris laoreet ut rhoncus aliquet pulvinar sed nisl nunc rhoncus dui vel sem sed sagittis nam congue
505,sed vestibulum sit amet cursus id turpis integer aliquet massa id lobortis convallis tortor risus,Sed ante. Vivamus tortor.,toys,698.41,868,Dynabox,Green,34.27,a odio in hac habitasse platea dictumst maecenas ut massa quis augue luctus tincidunt nulla mollis molestie
506,odio curabitur convallis duis consequat dui nec nisi volutpat eleifend donec ut dolor morbi vel lectus in quam fringilla rhoncus,Cras non velit nec nisi vulputate nonummy. Maecenas tincidunt lacus at velit.,beauty,937.37,74,Edgetag,Red,71.54,ut mauris eget massa tempor convallis nulla neque libero convallis eget eleifend luctus ultricies eu nibh quisque id
507,pede morbi porttitor lorem id ligula suspendisse ornare consequat lectus in est risus auctor sed tristique in,"Morbi non lectus. Aliquam sit amet diam in magna bibendum imperdiet. Nullam orci pede, venenatis non, sodales sed, tincidunt eu, felis. Fusce posuere felis sed lacus. Morbi sem mauris, laoreet ut, rhoncus aliquet, pulvinar sed, nisl. Nunc rhoncus dui vel sem. Sed sagittis. Nam congue, risus semper porta volutpat, quam pede lobortis ligula, sit amet eleifend pede libero quis orci. Nullam molestie nibh in lectus.",home goods,805.66,526,Meembee,Violet,23.44,magna vestibulum aliquet ultrices erat tortor sollicitudin mi sit amet lobortis sapien
508,praesent blandit lacinia erat vestibulum sed magna at nunc commodo placerat praesent blandit,"Aenean lectus. Pellentesque eget nunc. Donec quis orci eget orci vehicula condimentum. Curabitur in libero ut massa volutpat convallis. Morbi odio odio, elementum eu, interdum eu, tincidunt in, leo.",beauty,794.0,857,Riffpath,Puce,46.62,elementum ligula vehicula consequat morbi a ipsum integer a nibh in quis justo maecenas rhoncus aliquam lacus
509,curae mauris viverra diam vitae quam suspendisse potenti nullam porttitor lacus,"Curabitur in libero ut massa volutpat convallis. Morbi odio odio, elementum eu, interdum eu, tincidunt in, leo.",beauty,830.98,749,Vidoo,Crimson,75.64,sollicitudin vitae consectetuer eget rutrum at lorem integer tincidunt ante vel ipsum praesent blandit
510,commodo placerat praesent blandit nam nulla integer pede justo lacinia eget tincidunt eget tempus vel pede,"Nunc rhoncus dui vel sem. Sed sagittis. Nam congue, risus semper porta volutpat, quam pede lobortis ligula, sit amet eleifend pede libero quis orci.",electronics,996.12,356,Avamm,Maroon,79.04,mauris non ligula pellentesque ultrices phasellus id sapien in sapien iaculis congue vivamus metus
511,orci mauris lacinia sapien quis libero nullam sit amet turpis elementum ligula,"In quis justo. Maecenas rhoncus aliquam lacus. Morbi quis tortor id nulla ultrices aliquet. Maecenas leo odio, condimentum id, luctus nec, molestie sed, justo. Pellentesque viverra pede ac diam. Cras pellentesque volutpat dui. Maecenas tristique, est et tempus semper, est quam pharetra magna, ac consequat metus sapien ut nunc. Vestibulum ante ipsum primis in faucibus orci luctus et ultrices posuere cubilia Curae; Mauris viverra diam vitae quam. Suspendisse potenti. Nullam porttitor lacus at turpis.",toys,50.01,69,Kamba,Teal,28.2,quam turpis adipiscing lorem vitae mattis nibh ligula nec sem duis aliquam convallis nunc proin at
512,orci luctus et ultrices posuere cubilia curae nulla dapibus dolor,"Nulla nisl. Nunc nisl. Duis bibendum, felis sed interdum venenatis, turpis enim blandit mi, in porttitor pede justo eu massa. Donec dapibus. Duis at velit eu est congue elementum. In hac habitasse platea dictumst. Morbi vestibulum, velit id pretium iaculis, diam erat fermentum justo, nec condimentum neque sapien placerat ante. Nulla justo. Aliquam quis turpis eget elit sodales scelerisque. Mauris sit amet eros.",electronics,146.17,765,Janyx,Fuscia,12.66,sed tristique in tempus sit amet sem fusce consequat nulla
513,nunc proin at turpis a pede posuere nonummy integer non velit donec diam neque vestibulum eget vulputate ut ultrices vel,Mauris sit amet eros.,electronics,372.78,109,Eazzy,Violet,92.73,nulla quisque arcu libero rutrum ac lobortis vel dapibus at diam nam tristique tortor eu
514,odio elementum eu interdum eu tincidunt in leo maecenas pulvinar lobortis est phasellus sit,"Curabitur convallis. Duis consequat dui nec nisi volutpat eleifend. Donec ut dolor. Morbi vel lectus in quam fringilla rhoncus. Mauris enim leo, rhoncus sed, vestibulum sit amet, cursus id, turpis.",beauty,153.48,133,Yodel,Fuscia,90.54,auctor sed tristique in tempus sit amet sem fusce consequat nulla nisl nunc nisl duis bibendum felis sed interdum
515,nisl duis ac nibh fusce lacus purus aliquet at feugiat non pretium quis lectus suspendisse,"Nunc nisl. Duis bibendum, felis sed interdum venenatis, turpis enim blandit mi, in porttitor pede justo eu massa.",toys,592.28,144,Flipbug,Mauv,1.26,dui proin leo odio porttitor id consequat in consequat ut nulla sed accumsan
516,justo pellentesque viverra pede ac diam cras pellentesque volutpat dui,"Integer non velit. Donec diam neque, vestibulum eget, vulputate ut, ultrices vel, augue. Vestibulum ante ipsum primis in faucibus orci luctus et ultrices posuere cubilia Curae; Donec pharetra, magna vestibulum aliquet ultrices, erat tortor sollicitudin mi, sit amet lobortis sapien sapien non mi. Integer ac neque. Duis bibendum. Morbi non quam nec dui luctus rutrum. Nulla tellus.",beauty,76.74,266,Yambee,Fuscia,44.05,sapien urna pretium nisl ut volutpat sapien arcu sed augue aliquam erat volutpat in
517,mi nulla ac enim in tempor turpis nec euismod scelerisque,"Proin interdum mauris non ligula pellentesque ultrices. Phasellus id sapien in sapien iaculis congue. Vivamus metus arcu, adipiscing molestie, hendrerit at, vulputate vitae, nisl. Aenean lectus.",home goods,640.52,319,Brainbox,Mauv,24.63,at nulla suspendisse potenti cras in purus eu magna vulputate luctus
518,amet diam in magna bibendum imperdiet nullam orci pede venenatis,"Phasellus id sapien in sapien iaculis congue. Vivamus metus arcu, adipiscing molestie, hendrerit at, vulputate vitae, nisl. Aenean lectus. Pellentesque eget nunc. Donec quis orci eget orci vehicula condimentum.",clothing,926.41,843,Omba,Red,54.26,duis mattis egestas metus aenean fermentum donec ut mauris eget massa tempor convallis nulla neque libero convallis eget
519,diam neque vestibulum eget vulputate ut ultrices vel augue vestibulum ante ipsum primis in faucibus orci,Maecenas rhoncus aliquam lacus. Morbi quis tortor id nulla ultrices aliquet.,clothing,550.62,676,Linkbuzz,Teal,65.91,justo in hac habitasse platea dictumst etiam faucibus cursus urna ut tellus nulla ut erat id
520,pede libero quis orci nullam molestie nibh in lectus pellentesque at nulla suspendisse potenti cras in purus eu magna vulputate,"Aliquam quis turpis eget elit sodales scelerisque. Mauris sit amet eros. Suspendisse accumsan tortor quis turpis. Sed ante. Vivamus tortor. Duis mattis egestas metus. Aenean fermentum. Donec ut mauris eget massa tempor convallis. Nulla neque libero, convallis eget, eleifend luctus, ultricies eu, nibh.",electronics,272.17,660,Snaptags,Green,62.59,purus eu magna vulputate luctus cum sociis natoque penatibus et
521,magna ac consequat metus sapien ut nunc vestibulum ante ipsum primis in faucibus orci luctus,"Donec diam neque, vestibulum eget, vulputate ut, ultrices vel, augue. Vestibulum ante ipsum primis in faucibus orci luctus et ultrices posuere cubilia Curae; Donec pharetra, magna vestibulum aliquet ultrices, erat tortor sollicitudin mi, sit amet lobortis sapien sapien non mi. Integer ac neque. Duis bibendum. Morbi non quam nec dui luctus rutrum.",clothing,141.78,557,Feednation,Mauv,83.02,arcu adipiscing molestie hendrerit at vulputate vitae nisl aenean lectus pellentesque eget nunc donec quis orci eget orci
522,sit amet sapien dignissim vestibulum vestibulum ante ipsum primis in faucibus orci luctus,"Vivamus in felis eu sapien cursus vestibulum. Proin eu mi. Nulla ac enim. In tempor, turpis nec euismod scelerisque, quam turpis adipiscing lorem, vitae mattis nibh ligula nec sem. Duis aliquam convallis nunc. Proin at turpis a pede posuere nonummy. Integer non velit. Donec diam neque, vestibulum eget, vulputate ut, ultrices vel, augue. Vestibulum ante ipsum primis in faucibus orci luctus et ultrices posuere cubilia Curae; Donec pharetra, magna vestibulum aliquet ultrices, erat tortor sollicitudin mi, sit amet lobortis sapien sapien non mi. Integer ac neque.",beauty,934.55,507,Browsebug,Goldenrod,90.85,consectetuer adipiscing elit proin interdum mauris non ligula pellentesque ultrices phasellus id sapien in sapien iaculis congue vivamus metus arcu
523,nam nulla integer pede justo lacinia eget tincidunt eget tempus,"Fusce lacus purus, aliquet at, feugiat non, pretium quis, lectus. Suspendisse potenti. In eleifend quam a odio. In hac habitasse platea dictumst. Maecenas ut massa quis augue luctus tincidunt. Nulla mollis molestie lorem. Quisque ut erat. Curabitur gravida nisi at nibh. In hac habitasse platea dictumst.",clothing,267.47,895,Blogtags,Green,94.12,mattis egestas metus aenean fermentum donec ut mauris eget massa tempor convallis nulla
524,tincidunt eget tempus vel pede morbi porttitor lorem id ligula suspendisse ornare consequat,Vestibulum ante ipsum primis in faucibus orci luctus et ultrices posuere cubilia Curae; Mauris viverra diam vitae quam. Suspendisse potenti. Nullam porttitor lacus at turpis.,beauty,430.9,843,Skippad,Orange,19.15,eu magna vulputate luctus cum sociis natoque penatibus et magnis dis parturient montes nascetur
525,fermentum donec ut mauris eget massa tempor convallis nulla neque libero convallis,"Maecenas pulvinar lobortis est. Phasellus sit amet erat. Nulla tempus. Vivamus in felis eu sapien cursus vestibulum. Proin eu mi. Nulla ac enim. In tempor, turpis nec euismod scelerisque, quam turpis adipiscing lorem, vitae mattis nibh ligula nec sem. Duis aliquam convallis nunc. Proin at turpis a pede posuere nonummy.",electronics,560.36,546,Leenti,Aquamarine,87.56,curae duis faucibus accumsan odio curabitur convallis duis consequat dui
526,dis parturient montes nascetur ridiculus mus vivamus vestibulum sagittis sapien cum sociis natoque penatibus et magnis dis parturient,"Aenean fermentum. Donec ut mauris eget massa tempor convallis. Nulla neque libero, convallis eget, eleifend luctus, ultricies eu, nibh.",toys,435.68,271,Riffpath,Indigo,91.14,volutpat eleifend donec ut dolor morbi vel lectus in quam fringilla rhoncus mauris
527,sit amet lobortis sapien sapien non mi integer ac neque duis bibendum morbi non quam nec dui luctus,Maecenas pulvinar lobortis est. Phasellus sit amet erat. Nulla tempus. Vivamus in felis eu sapien cursus vestibulum. Proin eu mi.,electronics,269.96,940,Demizz,Mauv,37.34,vivamus vel nulla eget eros elementum pellentesque quisque porta volutpat erat quisque erat eros viverra eget congue eget
528,vestibulum rutrum rutrum neque aenean auctor gravida sem praesent id massa id nisl venenatis lacinia aenean sit amet justo,"Ut at dolor quis odio consequat varius. Integer ac leo. Pellentesque ultrices mattis odio. Donec vitae nisi. Nam ultrices, libero non mattis pulvinar, nulla pede ullamcorper augue, a suscipit nulla elit ac nulla. Sed vel enim sit amet nunc viverra dapibus. Nulla suscipit ligula in lacus. Curabitur at ipsum ac tellus semper interdum. Mauris ullamcorper purus sit amet nulla. Quisque arcu libero, rutrum ac, lobortis vel, dapibus at, diam.",beauty,922.59,674,Geba,Red,29.49,felis ut at dolor quis odio consequat varius integer ac leo pellentesque ultrices mattis odio donec vitae nisi
529,nec sem duis aliquam convallis nunc proin at turpis a pede posuere nonummy integer non,"Nam congue, risus semper porta volutpat, quam pede lobortis ligula, sit amet eleifend pede libero quis orci. Nullam molestie nibh in lectus. Pellentesque at nulla. Suspendisse potenti. Cras in purus eu magna vulputate luctus. Cum sociis natoque penatibus et magnis dis parturient montes, nascetur ridiculus mus.",clothing,576.24,924,Aibox,Khaki,0.88,dui nec nisi volutpat eleifend donec ut dolor morbi vel lectus in quam fringilla rhoncus mauris enim leo rhoncus sed
530,consectetuer eget rutrum at lorem integer tincidunt ante vel ipsum praesent blandit lacinia erat vestibulum sed magna at,Praesent blandit lacinia erat. Vestibulum sed magna at nunc commodo placerat. Praesent blandit. Nam nulla.,clothing,939.3,192,Quinu,Fuscia,48.52,sapien sapien non mi integer ac neque duis bibendum morbi non quam nec dui luctus rutrum nulla tellus
531,sed ante vivamus tortor duis mattis egestas metus aenean fermentum donec ut mauris eget massa,"Maecenas leo odio, condimentum id, luctus nec, molestie sed, justo. Pellentesque viverra pede ac diam. Cras pellentesque volutpat dui. Maecenas tristique, est et tempus semper, est quam pharetra magna, ac consequat metus sapien ut nunc.",beauty,520.19,257,Kare,Goldenrod,86.96,ultrices posuere cubilia curae mauris viverra diam vitae quam suspendisse potenti
532,nulla nunc purus phasellus in felis donec semper sapien a,"Cum sociis natoque penatibus et magnis dis parturient montes, nascetur ridiculus mus. Vivamus vestibulum sagittis sapien.",home goods,391.19,352,Zoomcast,Crimson,64.21,dolor morbi vel lectus in quam fringilla rhoncus mauris enim leo rhoncus sed vestibulum sit
533,dignissim vestibulum vestibulum ante ipsum primis in faucibus orci luctus et ultrices posuere cubilia curae nulla dapibus dolor vel est,"Suspendisse ornare consequat lectus. In est risus, auctor sed, tristique in, tempus sit amet, sem. Fusce consequat. Nulla nisl. Nunc nisl. Duis bibendum, felis sed interdum venenatis, turpis enim blandit mi, in porttitor pede justo eu massa. Donec dapibus. Duis at velit eu est congue elementum.",home goods,743.19,562,Roombo,Aquamarine,53.0,sed interdum venenatis turpis enim blandit mi in porttitor pede justo eu massa donec dapibus duis at
534,accumsan tortor quis turpis sed ante vivamus tortor duis mattis egestas metus aenean fermentum donec ut mauris eget,Praesent id massa id nisl venenatis lacinia.,home goods,71.69,389,Brightbean,Pink,9.23,etiam faucibus cursus urna ut tellus nulla ut erat id mauris vulputate elementum
535,fermentum justo nec condimentum neque sapien placerat ante nulla justo aliquam quis turpis eget elit sodales scelerisque mauris sit amet,Nulla nisl. Nunc nisl.,home goods,648.31,201,Browsetype,Purple,3.22,volutpat eleifend donec ut dolor morbi vel lectus in quam fringilla rhoncus mauris enim leo rhoncus sed vestibulum sit amet
536,nisl duis ac nibh fusce lacus purus aliquet at feugiat non pretium quis,"In blandit ultrices enim. Lorem ipsum dolor sit amet, consectetuer adipiscing elit. Proin interdum mauris non ligula pellentesque ultrices. Phasellus id sapien in sapien iaculis congue. Vivamus metus arcu, adipiscing molestie, hendrerit at, vulputate vitae, nisl. Aenean lectus.",electronics,254.36,71,Kimia,Teal,91.3,convallis nunc proin at turpis a pede posuere nonummy integer non velit
537,libero ut massa volutpat convallis morbi odio odio elementum eu interdum eu tincidunt in leo maecenas pulvinar lobortis est phasellus,"Ut tellus. Nulla ut erat id mauris vulputate elementum. Nullam varius. Nulla facilisi. Cras non velit nec nisi vulputate nonummy. Maecenas tincidunt lacus at velit. Vivamus vel nulla eget eros elementum pellentesque. Quisque porta volutpat erat. Quisque erat eros, viverra eget, congue eget, semper rutrum, nulla. Nunc purus.",electronics,775.09,90,Voolia,Pink,96.89,aliquam erat volutpat in congue etiam justo etiam pretium iaculis justo in
538,vulputate justo in blandit ultrices enim lorem ipsum dolor sit amet consectetuer adipiscing elit proin interdum,Donec dapibus. Duis at velit eu est congue elementum. In hac habitasse platea dictumst.,electronics,316.88,405,Latz,Goldenrod,80.41,suscipit a feugiat et eros vestibulum ac est lacinia nisi venenatis tristique fusce congue diam id ornare imperdiet sapien
539,metus aenean fermentum donec ut mauris eget massa tempor convallis,"Nunc rhoncus dui vel sem. Sed sagittis. Nam congue, risus semper porta volutpat, quam pede lobortis ligula, sit amet eleifend pede libero quis orci. Nullam molestie nibh in lectus.",home goods,859.47,710,Edgeify,Maroon,87.85,adipiscing lorem vitae mattis nibh ligula nec sem duis aliquam convallis nunc proin at turpis a pede posuere nonummy integer
540,eu nibh quisque id justo sit amet sapien dignissim vestibulum,"Fusce congue, diam id ornare imperdiet, sapien urna pretium nisl, ut volutpat sapien arcu sed augue.",clothing,139.9,45,Youfeed,Teal,80.09,id nisl venenatis lacinia aenean sit amet justo morbi ut odio cras mi pede
