product_id,product_name,description,category,price,quantity,brand,color,weight,dimensions
1,turpis eget elit sodales scelerisque mauris sit amet eros suspendisse,Pellentesque viverra pede ac diam.,clothing,344.38,173,Photojam,Yellow,45.45,posuere metus vitae ipsum aliquam non mauris morbi non lectus aliquam sit amet diam
2,turpis integer aliquet massa id lobortis convallis tortor risus dapibus augue vel accumsan tellus nisi eu,"Sed accumsan felis. Ut at dolor quis odio consequat varius. Integer ac leo. Pellentesque ultrices mattis odio. Donec vitae nisi. Nam ultrices, libero non mattis pulvinar, nulla pede ullamcorper augue, a suscipit nulla elit ac nulla.",beauty,835.95,215,Npath,Pink,54.47,semper sapien a libero nam dui proin leo odio porttitor id consequat in consequat ut nulla sed accumsan
3,fusce posuere felis sed lacus morbi sem mauris laoreet ut rhoncus aliquet pulvinar sed nisl nunc rhoncus dui,"Quisque id justo sit amet sapien dignissim vestibulum. Vestibulum ante ipsum primis in faucibus orci luctus et ultrices posuere cubilia Curae; Nulla dapibus dolor vel est. Donec odio justo, sollicitudin ut, suscipit a, feugiat et, eros. Vestibulum ac est lacinia nisi venenatis tristique. Fusce congue, diam id ornare imperdiet, sapien urna pretium nisl, ut volutpat sapien arcu sed augue. Aliquam erat volutpat. In congue. Etiam justo. Etiam pretium iaculis justo. In hac habitasse platea dictumst.",toys,653.51,416,Rhybox,Turquoise,65.41,sapien placerat ante nulla justo aliquam quis turpis eget elit sodales scelerisque mauris sit amet eros suspendisse accumsan tortor quis
4,eget congue eget semper rutrum nulla nunc purus phasellus in felis donec semper sapien a libero,Etiam justo. Etiam pretium iaculis justo. In hac habitasse platea dictumst. Etiam faucibus cursus urna. Ut tellus. Nulla ut erat id mauris vulputate elementum. Nullam varius. Nulla facilisi. Cras non velit nec nisi vulputate nonummy.,home goods,610.03,964,Aivee,Puce,27.44,ultrices posuere cubilia curae donec pharetra magna vestibulum aliquet ultrices erat tortor sollicitudin mi sit amet lobortis sapien
5,vestibulum ante ipsum primis in faucibus orci luctus et ultrices,Donec posuere metus vitae ipsum. Aliquam non mauris. Morbi non lectus. Aliquam sit amet diam in magna bibendum imperdiet.,electronics,462.32,216,Oyoba,Teal,93.95,in sagittis dui vel nisl duis ac nibh fusce lacus purus aliquet at feugiat non pretium
6,in lacus curabitur at ipsum ac tellus semper interdum mauris,"Aenean sit amet justo. Morbi ut odio. Cras mi pede, malesuada in, imperdiet et, commodo vulputate, justo. In blandit ultrices enim. Lorem ipsum dolor sit amet, consectetuer adipiscing elit. Proin interdum mauris non ligula pellentesque ultrices. Phasellus id sapien in sapien iaculis congue. Vivamus metus arcu, adipiscing molestie, hendrerit at, vulputate vitae, nisl.",toys,614.05,862,Yadel,Crimson,37.99,porttitor id consequat in consequat ut nulla sed accumsan felis ut at dolor quis odio consequat varius
7,morbi porttitor lorem id ligula suspendisse ornare consequat lectus in,Mauris lacinia sapien quis libero. Nullam sit amet turpis elementum ligula vehicula consequat. Morbi a ipsum. Integer a nibh. In quis justo. Maecenas rhoncus aliquam lacus.,electronics,905.81,631,Jatri,Pink,94.69,et ultrices posuere cubilia curae donec pharetra magna vestibulum aliquet ultrices erat tortor sollicitudin
8,curae nulla dapibus dolor vel est donec odio justo sollicitudin ut suscipit a,"Quisque erat eros, viverra eget, congue eget, semper rutrum, nulla. Nunc purus. Phasellus in felis. Donec semper sapien a libero. Nam dui. Proin leo odio, porttitor id, consequat in, consequat ut, nulla. Sed accumsan felis. Ut at dolor quis odio consequat varius.",toys,162.45,263,Skinte,Blue,64.69,faucibus cursus urna ut tellus nulla ut erat id mauris vulputate elementum nullam varius nulla facilisi cras non velit nec
9,laoreet ut rhoncus aliquet pulvinar sed nisl nunc rhoncus dui vel sem sed sagittis nam congue risus semper porta volutpat,"Duis mattis egestas metus. Aenean fermentum. Donec ut mauris eget massa tempor convallis. Nulla neque libero, convallis eget, eleifend luctus, ultricies eu, nibh. Quisque id justo sit amet sapien dignissim vestibulum. Vestibulum ante ipsum primis in faucibus orci luctus et ultrices posuere cubilia Curae; Nulla dapibus dolor vel est. Donec odio justo, sollicitudin ut, suscipit a, feugiat et, eros. Vestibulum ac est lacinia nisi venenatis tristique. Fusce congue, diam id ornare imperdiet, sapien urna pretium nisl, ut volutpat sapien arcu sed augue.",clothing,828.22,1000,Oyope,Violet,63.5,elementum in hac habitasse platea dictumst morbi vestibulum velit id pretium iaculis diam erat fermentum
10,ultrices phasellus id sapien in sapien iaculis congue vivamus metus arcu adipiscing molestie hendrerit,"Nam ultrices, libero non mattis pulvinar, nulla pede ullamcorper augue, a suscipit nulla elit ac nulla. Sed vel enim sit amet nunc viverra dapibus. Nulla suscipit ligula in lacus. Curabitur at ipsum ac tellus semper interdum. Mauris ullamcorper purus sit amet nulla. Quisque arcu libero, rutrum ac, lobortis vel, dapibus at, diam.",electronics,99.64,258,Flipopia,Blue,56.86,felis eu sapien cursus vestibulum proin eu mi nulla ac enim in tempor turpis nec euismod scelerisque quam turpis
11,mauris vulputate elementum nullam varius nulla facilisi cras non velit nec nisi vulputate nonummy maecenas tincidunt lacus,"Proin eu mi. Nulla ac enim. In tempor, turpis nec euismod scelerisque, quam turpis adipiscing lorem, vitae mattis nibh ligula nec sem. Duis aliquam convallis nunc. Proin at turpis a pede posuere nonummy. Integer non velit.",clothing,117.34,49,Vitz,Aquamarine,79.32,lacinia sapien quis libero nullam sit amet turpis elementum ligula vehicula
12,ac diam cras pellentesque volutpat dui maecenas tristique est et tempus semper est quam pharetra,"Proin risus. Praesent lectus. Vestibulum quam sapien, varius ut, blandit non, interdum in, ante. Vestibulum ante ipsum primis in faucibus orci luctus et ultrices posuere cubilia Curae; Duis faucibus accumsan odio. Curabitur convallis. Duis consequat dui nec nisi volutpat eleifend. Donec ut dolor. Morbi vel lectus in quam fringilla rhoncus. Mauris enim leo, rhoncus sed, vestibulum sit amet, cursus id, turpis.",clothing,22.76,259,Zoonder,Red,3.34,integer ac leo pellentesque ultrices mattis odio donec vitae nisi nam ultrices libero non mattis pulvinar
13,lacinia erat vestibulum sed magna at nunc commodo placerat praesent blandit nam nulla integer pede,"Lorem ipsum dolor sit amet, consectetuer adipiscing elit. Proin interdum mauris non ligula pellentesque ultrices. Phasellus id sapien in sapien iaculis congue. Vivamus metus arcu, adipiscing molestie, hendrerit at, vulputate vitae, nisl. Aenean lectus. Pellentesque eget nunc. Donec quis orci eget orci vehicula condimentum.",beauty,382.66,657,Twitterbridge,Goldenrod,81.74,ultrices enim lorem ipsum dolor sit amet consectetuer adipiscing elit proin interdum mauris non ligula pellentesque ultrices phasellus id sapien
14,lorem ipsum dolor sit amet consectetuer adipiscing elit proin risus praesent lectus vestibulum quam,"Nunc nisl. Duis bibendum, felis sed interdum venenatis, turpis enim blandit mi, in porttitor pede justo eu massa. Donec dapibus. Duis at velit eu est congue elementum.",beauty,48.07,332,Flashset,Indigo,82.32,gravida nisi at nibh in hac habitasse platea dictumst aliquam augue quam
15,libero convallis eget eleifend luctus ultricies eu nibh quisque id justo sit amet sapien dignissim,"Praesent id massa id nisl venenatis lacinia. Aenean sit amet justo. Morbi ut odio. Cras mi pede, malesuada in, imperdiet et, commodo vulputate, justo. In blandit ultrices enim. Lorem ipsum dolor sit amet, consectetuer adipiscing elit. Proin interdum mauris non ligula pellentesque ultrices. Phasellus id sapien in sapien iaculis congue. Vivamus metus arcu, adipiscing molestie, hendrerit at, vulputate vitae, nisl. Aenean lectus.",home goods,169.03,35,Youspan,Blue,11.8,tristique in tempus sit amet sem fusce consequat nulla nisl nunc nisl duis bibendum felis sed interdum venenatis
16,amet sem fusce consequat nulla nisl nunc nisl duis bibendum felis sed interdum venenatis,"In blandit ultrices enim. Lorem ipsum dolor sit amet, consectetuer adipiscing elit. Proin interdum mauris non ligula pellentesque ultrices. Phasellus id sapien in sapien iaculis congue. Vivamus metus arcu, adipiscing molestie, hendrerit at, vulputate vitae, nisl. Aenean lectus.",beauty,702.38,187,Realbuzz,Khaki,22.86,duis aliquam convallis nunc proin at turpis a pede posuere nonummy integer non velit donec diam neque vestibulum eget
17,viverra eget congue eget semper rutrum nulla nunc purus phasellus in felis donec semper sapien a,Nulla facilisi.,beauty,329.53,678,Jabbersphere,Aquamarine,36.48,tortor duis mattis egestas metus aenean fermentum donec ut mauris eget massa tempor
18,volutpat in congue etiam justo etiam pretium iaculis justo in hac habitasse platea dictumst etiam faucibus cursus urna,"Donec vitae nisi. Nam ultrices, libero non mattis pulvinar, nulla pede ullamcorper augue, a suscipit nulla elit ac nulla. Sed vel enim sit amet nunc viverra dapibus. Nulla suscipit ligula in lacus. Curabitur at ipsum ac tellus semper interdum. Mauris ullamcorper purus sit amet nulla.",home goods,146.56,726,Tanoodle,Red,55.04,vestibulum proin eu mi nulla ac enim in tempor turpis nec euismod scelerisque
19,aliquam quis turpis eget elit sodales scelerisque mauris sit amet eros suspendisse accumsan tortor quis,"Aenean auctor gravida sem. Praesent id massa id nisl venenatis lacinia. Aenean sit amet justo. Morbi ut odio. Cras mi pede, malesuada in, imperdiet et, commodo vulputate, justo. In blandit ultrices enim. Lorem ipsum dolor sit amet, consectetuer adipiscing elit. Proin interdum mauris non ligula pellentesque ultrices. Phasellus id sapien in sapien iaculis congue.",home goods,934.79,985,Skynoodle,Mauv,99.73,sodales scelerisque mauris sit amet eros suspendisse accumsan tortor quis turpis sed ante
20,odio donec vitae nisi nam ultrices libero non mattis pulvinar nulla pede ullamcorper augue a,Nulla nisl.,beauty,252.01,530,Latz,Maroon,28.67,blandit mi in porttitor pede justo eu massa donec dapibus duis
21,a suscipit nulla elit ac nulla sed vel enim sit amet nunc viverra dapibus nulla suscipit ligula in,"In hac habitasse platea dictumst. Morbi vestibulum, velit id pretium iaculis, diam erat fermentum justo, nec condimentum neque sapien placerat ante. Nulla justo. Aliquam quis turpis eget elit sodales scelerisque.",toys,277.4,7,Eidel,Fuscia,71.4,nec sem duis aliquam convallis nunc proin at turpis a pede posuere nonummy integer non velit donec
22,blandit nam nulla integer pede justo lacinia eget tincidunt eget tempus vel pede morbi porttitor lorem id,Suspendisse potenti. Cras in purus eu magna vulputate luctus.,electronics,905.92,357,Photobug,Fuscia,86.42,luctus rutrum nulla tellus in sagittis dui vel nisl duis ac nibh fusce lacus purus aliquet at feugiat non
23,consectetuer eget rutrum at lorem integer tincidunt ante vel ipsum praesent blandit lacinia erat,"Aliquam augue quam, sollicitudin vitae, consectetuer eget, rutrum at, lorem. Integer tincidunt ante vel ipsum. Praesent blandit lacinia erat.",home goods,888.54,192,Skibox,Mauv,51.87,erat curabitur gravida nisi at nibh in hac habitasse platea dictumst aliquam augue quam sollicitudin vitae consectetuer
24,justo sollicitudin ut suscipit a feugiat et eros vestibulum ac est,Nullam varius.,toys,196.33,122,Jabberbean,Mauv,46.76,pharetra magna vestibulum aliquet ultrices erat tortor sollicitudin mi sit
25,et eros vestibulum ac est lacinia nisi venenatis tristique fusce congue diam,"Cum sociis natoque penatibus et magnis dis parturient montes, nascetur ridiculus mus. Vivamus vestibulum sagittis sapien. Cum sociis natoque penatibus et magnis dis parturient montes, nascetur ridiculus mus.",beauty,435.03,982,Avamba,Green,23.61,ante ipsum primis in faucibus orci luctus et ultrices posuere cubilia curae nulla dapibus dolor vel est donec
26,etiam pretium iaculis justo in hac habitasse platea dictumst etiam faucibus cursus urna ut tellus nulla ut erat,"Integer non velit. Donec diam neque, vestibulum eget, vulputate ut, ultrices vel, augue. Vestibulum ante ipsum primis in faucibus orci luctus et ultrices posuere cubilia Curae; Donec pharetra, magna vestibulum aliquet ultrices, erat tortor sollicitudin mi, sit amet lobortis sapien sapien non mi. Integer ac neque. Duis bibendum. Morbi non quam nec dui luctus rutrum. Nulla tellus. In sagittis dui vel nisl. Duis ac nibh. Fusce lacus purus, aliquet at, feugiat non, pretium quis, lectus.",beauty,952.39,173,Eimbee,Crimson,24.04,proin interdum mauris non ligula pellentesque ultrices phasellus id sapien in
27,eget tincidunt eget tempus vel pede morbi porttitor lorem id,"Duis aliquam convallis nunc. Proin at turpis a pede posuere nonummy. Integer non velit. Donec diam neque, vestibulum eget, vulputate ut, ultrices vel, augue. Vestibulum ante ipsum primis in faucibus orci luctus et ultrices posuere cubilia Curae; Donec pharetra, magna vestibulum aliquet ultrices, erat tortor sollicitudin mi, sit amet lobortis sapien sapien non mi. Integer ac neque. Duis bibendum.",toys,699.27,268,Wordtune,Turquoise,53.69,dignissim vestibulum vestibulum ante ipsum primis in faucibus orci luctus et ultrices posuere cubilia curae
28,mauris morbi non lectus aliquam sit amet diam in magna bibendum imperdiet nullam orci pede venenatis non sodales sed tincidunt,"Suspendisse ornare consequat lectus. In est risus, auctor sed, tristique in, tempus sit amet, sem. Fusce consequat. Nulla nisl. Nunc nisl.",home goods,929.59,505,Mymm,Violet,18.42,turpis sed ante vivamus tortor duis mattis egestas metus aenean fermentum donec ut mauris eget massa tempor convallis nulla
29,cubilia curae duis faucibus accumsan odio curabitur convallis duis consequat dui nec nisi volutpat eleifend donec ut dolor morbi vel,"Morbi porttitor lorem id ligula. Suspendisse ornare consequat lectus. In est risus, auctor sed, tristique in, tempus sit amet, sem. Fusce consequat. Nulla nisl. Nunc nisl. Duis bibendum, felis sed interdum venenatis, turpis enim blandit mi, in porttitor pede justo eu massa. Donec dapibus. Duis at velit eu est congue elementum. In hac habitasse platea dictumst.",home goods,801.16,69,Skyble,Crimson,36.35,sapien in sapien iaculis congue vivamus metus arcu adipiscing molestie hendrerit at vulputate
30,sapien cursus vestibulum proin eu mi nulla ac enim in tempor turpis nec euismod scelerisque quam turpis adipiscing lorem vitae,"Cras pellentesque volutpat dui. Maecenas tristique, est et tempus semper, est quam pharetra magna, ac consequat metus sapien ut nunc. Vestibulum ante ipsum primis in faucibus orci luctus et ultrices posuere cubilia Curae; Mauris viverra diam vitae quam. Suspendisse potenti. Nullam porttitor lacus at turpis. Donec posuere metus vitae ipsum. Aliquam non mauris. Morbi non lectus. Aliquam sit amet diam in magna bibendum imperdiet. Nullam orci pede, venenatis non, sodales sed, tincidunt eu, felis.",beauty,136.32,595,Jaxbean,Blue,44.75,eget tempus vel pede morbi porttitor lorem id ligula suspendisse ornare consequat lectus in est risus auctor sed tristique
31,lectus in est risus auctor sed tristique in tempus sit amet sem fusce consequat nulla nisl nunc nisl duis,"Maecenas leo odio, condimentum id, luctus nec, molestie sed, justo. Pellentesque viverra pede ac diam. Cras pellentesque volutpat dui. Maecenas tristique, est et tempus semper, est quam pharetra magna, ac consequat metus sapien ut nunc. Vestibulum ante ipsum primis in faucibus orci luctus et ultrices posuere cubilia Curae; Mauris viverra diam vitae quam. Suspendisse potenti. Nullam porttitor lacus at turpis. Donec posuere metus vitae ipsum. Aliquam non mauris. Morbi non lectus.",beauty,455.64,723,Skinix,Puce,98.6,justo etiam pretium iaculis justo in hac habitasse platea dictumst etiam
32,potenti nullam porttitor lacus at turpis donec posuere metus vitae ipsum aliquam non mauris morbi non,"Fusce posuere felis sed lacus. Morbi sem mauris, laoreet ut, rhoncus aliquet, pulvinar sed, nisl.",toys,630.94,568,Kwideo,Orange,33.36,feugiat et eros vestibulum ac est lacinia nisi venenatis tristique fusce congue diam id ornare imperdiet sapien urna
33,volutpat eleifend donec ut dolor morbi vel lectus in quam fringilla rhoncus mauris,"Proin interdum mauris non ligula pellentesque ultrices. Phasellus id sapien in sapien iaculis congue. Vivamus metus arcu, adipiscing molestie, hendrerit at, vulputate vitae, nisl. Aenean lectus. Pellentesque eget nunc. Donec quis orci eget orci vehicula condimentum. Curabitur in libero ut massa volutpat convallis. Morbi odio odio, elementum eu, interdum eu, tincidunt in, leo. Maecenas pulvinar lobortis est. Phasellus sit amet erat.",home goods,260.61,454,Skivee,Crimson,45.63,feugiat non pretium quis lectus suspendisse potenti in eleifend quam a odio in
34,ullamcorper purus sit amet nulla quisque arcu libero rutrum ac lobortis vel dapibus at diam nam tristique,"Quisque id justo sit amet sapien dignissim vestibulum. Vestibulum ante ipsum primis in faucibus orci luctus et ultrices posuere cubilia Curae; Nulla dapibus dolor vel est. Donec odio justo, sollicitudin ut, suscipit a, feugiat et, eros. Vestibulum ac est lacinia nisi venenatis tristique. Fusce congue, diam id ornare imperdiet, sapien urna pretium nisl, ut volutpat sapien arcu sed augue. Aliquam erat volutpat. In congue. Etiam justo. Etiam pretium iaculis justo. In hac habitasse platea dictumst.",beauty,829.46,667,Meejo,Crimson,51.99,vel est donec odio justo sollicitudin ut suscipit a feugiat et eros vestibulum ac
35,maecenas pulvinar lobortis est phasellus sit amet erat nulla tempus vivamus in felis eu sapien cursus vestibulum proin eu,Proin eu mi. Nulla ac enim.,home goods,126.11,125,Blogpad,Yellow,5.12,cubilia curae donec pharetra magna vestibulum aliquet ultrices erat tortor sollicitudin mi
36,in sagittis dui vel nisl duis ac nibh fusce lacus purus aliquet at feugiat non,"In tempor, turpis nec euismod scelerisque, quam turpis adipiscing lorem, vitae mattis nibh ligula nec sem.",electronics,69.86,988,Mymm,Teal,71.53,amet eleifend pede libero quis orci nullam molestie nibh in lectus pellentesque
37,lobortis sapien sapien non mi integer ac neque duis bibendum morbi,Quisque id justo sit amet sapien dignissim vestibulum.,clothing,32.06,247,Eabox,Goldenrod,51.22,porta volutpat quam pede lobortis ligula sit amet eleifend pede libero quis orci nullam molestie nibh in lectus pellentesque at
38,tortor id nulla ultrices aliquet maecenas leo odio condimentum id luctus nec molestie sed,"Duis ac nibh. Fusce lacus purus, aliquet at, feugiat non, pretium quis, lectus. Suspendisse potenti. In eleifend quam a odio. In hac habitasse platea dictumst. Maecenas ut massa quis augue luctus tincidunt. Nulla mollis molestie lorem. Quisque ut erat. Curabitur gravida nisi at nibh.",beauty,588.27,651,Edgeify,Violet,56.48,dui proin leo odio porttitor id consequat in consequat ut nulla sed accumsan felis ut at
39,morbi vestibulum velit id pretium iaculis diam erat fermentum justo nec condimentum neque,"Nulla tellus. In sagittis dui vel nisl. Duis ac nibh. Fusce lacus purus, aliquet at, feugiat non, pretium quis, lectus. Suspendisse potenti. In eleifend quam a odio. In hac habitasse platea dictumst. Maecenas ut massa quis augue luctus tincidunt. Nulla mollis molestie lorem. Quisque ut erat.",toys,117.74,724,Youspan,Mauv,20.28,in faucibus orci luctus et ultrices posuere cubilia curae mauris viverra diam vitae quam suspendisse potenti nullam porttitor lacus at
40,interdum in ante vestibulum ante ipsum primis in faucibus orci luctus et ultrices posuere cubilia curae,"Nulla mollis molestie lorem. Quisque ut erat. Curabitur gravida nisi at nibh. In hac habitasse platea dictumst. Aliquam augue quam, sollicitudin vitae, consectetuer eget, rutrum at, lorem. Integer tincidunt ante vel ipsum. Praesent blandit lacinia erat. Vestibulum sed magna at nunc commodo placerat. Praesent blandit. Nam nulla.",toys,334.58,56,Realblab,Blue,23.75,non lectus aliquam sit amet diam in magna bibendum imperdiet nullam orci pede venenatis non sodales sed tincidunt eu
41,quam nec dui luctus rutrum nulla tellus in sagittis dui vel,"Quisque id justo sit amet sapien dignissim vestibulum. Vestibulum ante ipsum primis in faucibus orci luctus et ultrices posuere cubilia Curae; Nulla dapibus dolor vel est. Donec odio justo, sollicitudin ut, suscipit a, feugiat et, eros. Vestibulum ac est lacinia nisi venenatis tristique. Fusce congue, diam id ornare imperdiet, sapien urna pretium nisl, ut volutpat sapien arcu sed augue. Aliquam erat volutpat.",electronics,485.74,735,Riffpedia,Red,50.67,sed nisl nunc rhoncus dui vel sem sed sagittis nam congue risus semper
42,eget eros elementum pellentesque quisque porta volutpat erat quisque erat eros viverra eget,Maecenas ut massa quis augue luctus tincidunt. Nulla mollis molestie lorem. Quisque ut erat. Curabitur gravida nisi at nibh. In hac habitasse platea dictumst.,electronics,681.87,896,Tagopia,Yellow,57.35,pede justo eu massa donec dapibus duis at velit eu
43,cum sociis natoque penatibus et magnis dis parturient montes nascetur ridiculus mus vivamus vestibulum sagittis sapien cum sociis natoque penatibus,"Integer non velit. Donec diam neque, vestibulum eget, vulputate ut, ultrices vel, augue. Vestibulum ante ipsum primis in faucibus orci luctus et ultrices posuere cubilia Curae; Donec pharetra, magna vestibulum aliquet ultrices, erat tortor sollicitudin mi, sit amet lobortis sapien sapien non mi. Integer ac neque.",clothing,923.14,355,Demimbu,Pink,14.84,nibh quisque id justo sit amet sapien dignissim vestibulum vestibulum ante ipsum primis in faucibus orci luctus et
44,quisque ut erat curabitur gravida nisi at nibh in hac habitasse platea dictumst aliquam augue quam sollicitudin vitae consectetuer,"Lorem ipsum dolor sit amet, consectetuer adipiscing elit. Proin interdum mauris non ligula pellentesque ultrices. Phasellus id sapien in sapien iaculis congue. Vivamus metus arcu, adipiscing molestie, hendrerit at, vulputate vitae, nisl. Aenean lectus. Pellentesque eget nunc. Donec quis orci eget orci vehicula condimentum. Curabitur in libero ut massa volutpat convallis. Morbi odio odio, elementum eu, interdum eu, tincidunt in, leo.",beauty,261.43,972,Oyope,Yellow,48.74,justo in hac habitasse platea dictumst etiam faucibus cursus urna ut tellus nulla ut erat id
45,id consequat in consequat ut nulla sed accumsan felis ut at dolor quis odio consequat varius integer,"Suspendisse potenti. Cras in purus eu magna vulputate luctus. Cum sociis natoque penatibus et magnis dis parturient montes, nascetur ridiculus mus. Vivamus vestibulum sagittis sapien. Cum sociis natoque penatibus et magnis dis parturient montes, nascetur ridiculus mus. Etiam vel augue.",beauty,723.5,406,Pixope,Turquoise,61.28,tortor sollicitudin mi sit amet lobortis sapien sapien non mi integer ac neque duis bibendum morbi
46,quis tortor id nulla ultrices aliquet maecenas leo odio condimentum id luctus nec,"Duis consequat dui nec nisi volutpat eleifend. Donec ut dolor. Morbi vel lectus in quam fringilla rhoncus. Mauris enim leo, rhoncus sed, vestibulum sit amet, cursus id, turpis.",toys,886.46,465,Rhycero,Mauv,28.44,eu magna vulputate luctus cum sociis natoque penatibus et magnis dis parturient montes nascetur ridiculus
47,posuere cubilia curae donec pharetra magna vestibulum aliquet ultrices erat tortor sollicitudin mi sit amet lobortis sapien,"Quisque ut erat. Curabitur gravida nisi at nibh. In hac habitasse platea dictumst. Aliquam augue quam, sollicitudin vitae, consectetuer eget, rutrum at, lorem. Integer tincidunt ante vel ipsum. Praesent blandit lacinia erat. Vestibulum sed magna at nunc commodo placerat.",toys,68.08,470,Brainsphere,Red,17.52,nibh in quis justo maecenas rhoncus aliquam lacus morbi quis tortor id
48,ultrices posuere cubilia curae nulla dapibus dolor vel est donec odio justo,"Praesent blandit. Nam nulla. Integer pede justo, lacinia eget, tincidunt eget, tempus vel, pede. Morbi porttitor lorem id ligula. Suspendisse ornare consequat lectus. In est risus, auctor sed, tristique in, tempus sit amet, sem.",beauty,167.59,179,Topiczoom,Purple,2.47,ac consequat metus sapien ut nunc vestibulum ante ipsum primis in faucibus
49,convallis duis consequat dui nec nisi volutpat eleifend donec ut dolor morbi vel lectus in,In hac habitasse platea dictumst.,electronics,621.64,715,Voomm,Teal,39.95,volutpat erat quisque erat eros viverra eget congue eget semper rutrum nulla
50,luctus et ultrices posuere cubilia curae mauris viverra diam vitae quam suspendisse potenti,"Duis consequat dui nec nisi volutpat eleifend. Donec ut dolor. Morbi vel lectus in quam fringilla rhoncus. Mauris enim leo, rhoncus sed, vestibulum sit amet, cursus id, turpis. Integer aliquet, massa id lobortis convallis, tortor risus dapibus augue, vel accumsan tellus nisi eu orci. Mauris lacinia sapien quis libero. Nullam sit amet turpis elementum ligula vehicula consequat. Morbi a ipsum.",electronics,777.23,945,Janyx,Violet,60.16,tortor duis mattis egestas metus aenean fermentum donec ut mauris eget massa tempor
51,ante ipsum primis in faucibus orci luctus et ultrices posuere cubilia curae mauris viverra diam vitae quam suspendisse,Vivamus in felis eu sapien cursus vestibulum. Proin eu mi.,beauty,420.79,543,Jaxworks,Aquamarine,69.08,dui maecenas tristique est et tempus semper est quam pharetra magna ac
