product_id,product_name,description,category,price,quantity,brand,color,weight,dimensions
218,sapien in sapien iaculis congue vivamus metus arcu adipiscing molestie hendrerit at vulputate vitae nisl aenean lectus pellentesque eget,"Curabitur in libero ut massa volutpat convallis. Morbi odio odio, elementum eu, interdum eu, tincidunt in, leo. Maecenas pulvinar lobortis est. Phasellus sit amet erat. Nulla tempus. Vivamus in felis eu sapien cursus vestibulum. Proin eu mi. Nulla ac enim. In tempor, turpis nec euismod scelerisque, quam turpis adipiscing lorem, vitae mattis nibh ligula nec sem. Duis aliquam convallis nunc.",electronics,326.71,557,LiveZ,Aquamarine,51.82,justo sit amet sapien dignissim vestibulum vestibulum ante ipsum primis in faucibus orci luctus et ultrices posuere cubilia
219,vitae mattis nibh ligula nec sem duis aliquam convallis nunc proin at turpis a pede posuere nonummy integer non velit,"Nulla tempus. Vivamus in felis eu sapien cursus vestibulum. Proin eu mi. Nulla ac enim. In tempor, turpis nec euismod scelerisque, quam turpis adipiscing lorem, vitae mattis nibh ligula nec sem. Duis aliquam convallis nunc.",clothing,906.27,550,Oyonder,Turquoise,29.6,lectus aliquam sit amet diam in magna bibendum imperdiet nullam
220,ac diam cras pellentesque volutpat dui maecenas tristique est et,"Donec quis orci eget orci vehicula condimentum. Curabitur in libero ut massa volutpat convallis. Morbi odio odio, elementum eu, interdum eu, tincidunt in, leo. Maecenas pulvinar lobortis est. Phasellus sit amet erat.",toys,162.92,473,Trilith,Fuscia,59.08,donec posuere metus vitae ipsum aliquam non mauris morbi non lectus aliquam sit amet diam in magna bibendum
221,velit eu est congue elementum in hac habitasse platea dictumst morbi vestibulum velit id pretium,"Morbi sem mauris, laoreet ut, rhoncus aliquet, pulvinar sed, nisl. Nunc rhoncus dui vel sem. Sed sagittis. Nam congue, risus semper porta volutpat, quam pede lobortis ligula, sit amet eleifend pede libero quis orci. Nullam molestie nibh in lectus. Pellentesque at nulla. Suspendisse potenti.",electronics,781.51,190,Skimia,Purple,17.28,ultricies eu nibh quisque id justo sit amet sapien dignissim vestibulum vestibulum
222,nisi volutpat eleifend donec ut dolor morbi vel lectus in quam fringilla rhoncus mauris enim leo rhoncus sed,"Pellentesque viverra pede ac diam. Cras pellentesque volutpat dui. Maecenas tristique, est et tempus semper, est quam pharetra magna, ac consequat metus sapien ut nunc. Vestibulum ante ipsum primis in faucibus orci luctus et ultrices posuere cubilia Curae; Mauris viverra diam vitae quam. Suspendisse potenti. Nullam porttitor lacus at turpis. Donec posuere metus vitae ipsum. Aliquam non mauris. Morbi non lectus.",toys,846.54,539,Flipstorm,Yellow,73.04,ut massa quis augue luctus tincidunt nulla mollis molestie lorem quisque ut erat curabitur gravida nisi at
223,sed justo pellentesque viverra pede ac diam cras pellentesque volutpat dui maecenas tristique est et tempus semper,"Nulla tellus. In sagittis dui vel nisl. Duis ac nibh. Fusce lacus purus, aliquet at, feugiat non, pretium quis, lectus. Suspendisse potenti. In eleifend quam a odio. In hac habitasse platea dictumst. Maecenas ut massa quis augue luctus tincidunt. Nulla mollis molestie lorem. Quisque ut erat.",home goods,400.6,477,Camimbo,Violet,2.8,convallis nulla neque libero convallis eget eleifend luctus ultricies eu nibh quisque id justo sit amet
224,porta volutpat quam pede lobortis ligula sit amet eleifend pede libero,"Nulla ut erat id mauris vulputate elementum. Nullam varius. Nulla facilisi. Cras non velit nec nisi vulputate nonummy. Maecenas tincidunt lacus at velit. Vivamus vel nulla eget eros elementum pellentesque. Quisque porta volutpat erat. Quisque erat eros, viverra eget, congue eget, semper rutrum, nulla.",home goods,820.02,101,Voonder,Blue,42.87,sit amet eros suspendisse accumsan tortor quis turpis sed ante
225,nulla nisl nunc nisl duis bibendum felis sed interdum venenatis turpis enim blandit,Ut tellus. Nulla ut erat id mauris vulputate elementum. Nullam varius. Nulla facilisi.,clothing,426.38,45,Vipe,Puce,57.13,purus eu magna vulputate luctus cum sociis natoque penatibus et magnis
226,ligula suspendisse ornare consequat lectus in est risus auctor sed,"Vestibulum ante ipsum primis in faucibus orci luctus et ultrices posuere cubilia Curae; Duis faucibus accumsan odio. Curabitur convallis. Duis consequat dui nec nisi volutpat eleifend. Donec ut dolor. Morbi vel lectus in quam fringilla rhoncus. Mauris enim leo, rhoncus sed, vestibulum sit amet, cursus id, turpis.",home goods,628.16,571,Jabbersphere,Goldenrod,34.64,nulla sed accumsan felis ut at dolor quis odio consequat varius integer ac leo pellentesque ultrices mattis odio donec
227,sit amet lobortis sapien sapien non mi integer ac neque,"Vestibulum ante ipsum primis in faucibus orci luctus et ultrices posuere cubilia Curae; Mauris viverra diam vitae quam. Suspendisse potenti. Nullam porttitor lacus at turpis. Donec posuere metus vitae ipsum. Aliquam non mauris. Morbi non lectus. Aliquam sit amet diam in magna bibendum imperdiet. Nullam orci pede, venenatis non, sodales sed, tincidunt eu, felis. Fusce posuere felis sed lacus. Morbi sem mauris, laoreet ut, rhoncus aliquet, pulvinar sed, nisl.",home goods,104.07,639,Quimba,Khaki,79.49,quam sapien varius ut blandit non interdum in ante vestibulum ante ipsum primis in faucibus orci luctus et
228,neque duis bibendum morbi non quam nec dui luctus rutrum nulla tellus in sagittis dui vel,"Vestibulum quam sapien, varius ut, blandit non, interdum in, ante. Vestibulum ante ipsum primis in faucibus orci luctus et ultrices posuere cubilia Curae; Duis faucibus accumsan odio. Curabitur convallis. Duis consequat dui nec nisi volutpat eleifend. Donec ut dolor.",electronics,72.78,204,Feednation,Aquamarine,47.06,ipsum primis in faucibus orci luctus et ultrices posuere cubilia curae mauris viverra diam
229,dictumst maecenas ut massa quis augue luctus tincidunt nulla mollis molestie lorem quisque ut erat curabitur gravida,"Integer ac neque. Duis bibendum. Morbi non quam nec dui luctus rutrum. Nulla tellus. In sagittis dui vel nisl. Duis ac nibh. Fusce lacus purus, aliquet at, feugiat non, pretium quis, lectus. Suspendisse potenti. In eleifend quam a odio.",beauty,875.59,527,Ozu,Green,25.81,pellentesque at nulla suspendisse potenti cras in purus eu magna vulputate luctus cum sociis natoque
230,at turpis donec posuere metus vitae ipsum aliquam non mauris morbi non lectus aliquam,Sed ante.,electronics,678.0,731,Skipstorm,Pink,59.92,vel nulla eget eros elementum pellentesque quisque porta volutpat erat quisque erat eros viverra eget congue eget semper rutrum
231,metus aenean fermentum donec ut mauris eget massa tempor convallis nulla neque libero convallis eget eleifend luctus ultricies eu,"Cras mi pede, malesuada in, imperdiet et, commodo vulputate, justo. In blandit ultrices enim. Lorem ipsum dolor sit amet, consectetuer adipiscing elit. Proin interdum mauris non ligula pellentesque ultrices. Phasellus id sapien in sapien iaculis congue.",beauty,162.1,932,Trudeo,Maroon,45.02,nascetur ridiculus mus vivamus vestibulum sagittis sapien cum sociis natoque
232,sit amet consectetuer adipiscing elit proin risus praesent lectus vestibulum quam sapien varius ut blandit,"Cum sociis natoque penatibus et magnis dis parturient montes, nascetur ridiculus mus. Etiam vel augue. Vestibulum rutrum rutrum neque. Aenean auctor gravida sem. Praesent id massa id nisl venenatis lacinia. Aenean sit amet justo. Morbi ut odio. Cras mi pede, malesuada in, imperdiet et, commodo vulputate, justo. In blandit ultrices enim. Lorem ipsum dolor sit amet, consectetuer adipiscing elit.",toys,681.33,5,Youspan,Indigo,23.86,pellentesque ultrices mattis odio donec vitae nisi nam ultrices libero non mattis pulvinar nulla
233,ipsum integer a nibh in quis justo maecenas rhoncus aliquam lacus morbi quis tortor id nulla ultrices aliquet maecenas leo,Etiam vel augue. Vestibulum rutrum rutrum neque. Aenean auctor gravida sem.,electronics,833.48,164,Photojam,Puce,66.7,sollicitudin ut suscipit a feugiat et eros vestibulum ac est lacinia nisi
234,eros viverra eget congue eget semper rutrum nulla nunc purus,Maecenas rhoncus aliquam lacus.,electronics,357.85,760,Jabberstorm,Orange,0.8,accumsan tortor quis turpis sed ante vivamus tortor duis mattis egestas metus aenean fermentum donec ut mauris eget massa tempor
235,sociis natoque penatibus et magnis dis parturient montes nascetur ridiculus mus vivamus vestibulum sagittis sapien cum sociis natoque,"Cras pellentesque volutpat dui. Maecenas tristique, est et tempus semper, est quam pharetra magna, ac consequat metus sapien ut nunc. Vestibulum ante ipsum primis in faucibus orci luctus et ultrices posuere cubilia Curae; Mauris viverra diam vitae quam. Suspendisse potenti. Nullam porttitor lacus at turpis. Donec posuere metus vitae ipsum. Aliquam non mauris. Morbi non lectus. Aliquam sit amet diam in magna bibendum imperdiet.",toys,622.88,638,Yodel,Blue,39.63,eu orci mauris lacinia sapien quis libero nullam sit amet turpis elementum ligula
236,nonummy maecenas tincidunt lacus at velit vivamus vel nulla eget eros elementum pellentesque,"Aenean sit amet justo. Morbi ut odio. Cras mi pede, malesuada in, imperdiet et, commodo vulputate, justo. In blandit ultrices enim. Lorem ipsum dolor sit amet, consectetuer adipiscing elit. Proin interdum mauris non ligula pellentesque ultrices. Phasellus id sapien in sapien iaculis congue. Vivamus metus arcu, adipiscing molestie, hendrerit at, vulputate vitae, nisl. Aenean lectus. Pellentesque eget nunc.",electronics,564.89,878,Oba,Fuscia,6.72,cras in purus eu magna vulputate luctus cum sociis natoque penatibus et magnis dis parturient montes nascetur
237,duis faucibus accumsan odio curabitur convallis duis consequat dui nec nisi volutpat eleifend donec ut dolor morbi vel lectus,"Maecenas leo odio, condimentum id, luctus nec, molestie sed, justo. Pellentesque viverra pede ac diam. Cras pellentesque volutpat dui. Maecenas tristique, est et tempus semper, est quam pharetra magna, ac consequat metus sapien ut nunc. Vestibulum ante ipsum primis in faucibus orci luctus et ultrices posuere cubilia Curae; Mauris viverra diam vitae quam. Suspendisse potenti. Nullam porttitor lacus at turpis. Donec posuere metus vitae ipsum. Aliquam non mauris. Morbi non lectus.",toys,319.96,745,Jabbercube,Red,86.02,at velit eu est congue elementum in hac habitasse platea dictumst morbi vestibulum
238,viverra pede ac diam cras pellentesque volutpat dui maecenas tristique,"Integer ac leo. Pellentesque ultrices mattis odio. Donec vitae nisi. Nam ultrices, libero non mattis pulvinar, nulla pede ullamcorper augue, a suscipit nulla elit ac nulla. Sed vel enim sit amet nunc viverra dapibus. Nulla suscipit ligula in lacus. Curabitur at ipsum ac tellus semper interdum. Mauris ullamcorper purus sit amet nulla. Quisque arcu libero, rutrum ac, lobortis vel, dapibus at, diam. Nam tristique tortor eu pede.",electronics,772.54,867,Demimbu,Puce,35.45,ipsum primis in faucibus orci luctus et ultrices posuere cubilia curae donec pharetra magna vestibulum aliquet ultrices erat tortor sollicitudin
239,amet eros suspendisse accumsan tortor quis turpis sed ante vivamus tortor,"Cras mi pede, malesuada in, imperdiet et, commodo vulputate, justo. In blandit ultrices enim. Lorem ipsum dolor sit amet, consectetuer adipiscing elit.",beauty,614.03,683,Yombu,Indigo,66.58,magnis dis parturient montes nascetur ridiculus mus vivamus vestibulum sagittis sapien cum sociis natoque penatibus et magnis dis parturient
240,libero rutrum ac lobortis vel dapibus at diam nam tristique tortor eu pede,"Aenean fermentum. Donec ut mauris eget massa tempor convallis. Nulla neque libero, convallis eget, eleifend luctus, ultricies eu, nibh. Quisque id justo sit amet sapien dignissim vestibulum. Vestibulum ante ipsum primis in faucibus orci luctus et ultrices posuere cubilia Curae; Nulla dapibus dolor vel est.",clothing,557.05,266,Tagpad,Fuscia,1.01,vel enim sit amet nunc viverra dapibus nulla suscipit ligula in lacus curabitur at ipsum
241,adipiscing elit proin interdum mauris non ligula pellentesque ultrices phasellus,Curabitur convallis. Duis consequat dui nec nisi volutpat eleifend. Donec ut dolor. Morbi vel lectus in quam fringilla rhoncus.,electronics,945.75,889,Youspan,Turquoise,2.17,nec dui luctus rutrum nulla tellus in sagittis dui vel nisl duis ac
242,vel nulla eget eros elementum pellentesque quisque porta volutpat erat,"Quisque porta volutpat erat. Quisque erat eros, viverra eget, congue eget, semper rutrum, nulla.",clothing,7.55,179,Jabbersphere,Green,57.54,lobortis est phasellus sit amet erat nulla tempus vivamus in felis eu sapien cursus vestibulum proin eu mi nulla ac
243,ipsum aliquam non mauris morbi non lectus aliquam sit amet diam in magna bibendum imperdiet,Maecenas pulvinar lobortis est.,electronics,666.38,865,Yakijo,Maroon,43.22,sit amet eleifend pede libero quis orci nullam molestie nibh in lectus pellentesque at nulla suspendisse potenti cras in
244,habitasse platea dictumst maecenas ut massa quis augue luctus tincidunt nulla mollis molestie,"Aenean sit amet justo. Morbi ut odio. Cras mi pede, malesuada in, imperdiet et, commodo vulputate, justo. In blandit ultrices enim. Lorem ipsum dolor sit amet, consectetuer adipiscing elit. Proin interdum mauris non ligula pellentesque ultrices.",toys,886.93,391,Roodel,Mauv,74.08,posuere metus vitae ipsum aliquam non mauris morbi non lectus aliquam sit amet diam in magna
245,purus eu magna vulputate luctus cum sociis natoque penatibus et magnis dis parturient montes nascetur,"Vestibulum ac est lacinia nisi venenatis tristique. Fusce congue, diam id ornare imperdiet, sapien urna pretium nisl, ut volutpat sapien arcu sed augue. Aliquam erat volutpat.",electronics,463.36,106,Photolist,Purple,50.88,magna ac consequat metus sapien ut nunc vestibulum ante ipsum primis in faucibus orci luctus et ultrices posuere cubilia curae
246,pulvinar nulla pede ullamcorper augue a suscipit nulla elit ac,"Sed sagittis. Nam congue, risus semper porta volutpat, quam pede lobortis ligula, sit amet eleifend pede libero quis orci. Nullam molestie nibh in lectus. Pellentesque at nulla. Suspendisse potenti. Cras in purus eu magna vulputate luctus. Cum sociis natoque penatibus et magnis dis parturient montes, nascetur ridiculus mus. Vivamus vestibulum sagittis sapien.",toys,373.82,146,Vinte,Aquamarine,70.4,donec pharetra magna vestibulum aliquet ultrices erat tortor sollicitudin mi sit amet lobortis sapien sapien non
247,justo in blandit ultrices enim lorem ipsum dolor sit amet consectetuer adipiscing elit proin,"Pellentesque ultrices mattis odio. Donec vitae nisi. Nam ultrices, libero non mattis pulvinar, nulla pede ullamcorper augue, a suscipit nulla elit ac nulla. Sed vel enim sit amet nunc viverra dapibus. Nulla suscipit ligula in lacus. Curabitur at ipsum ac tellus semper interdum.",electronics,534.23,290,Talane,Indigo,5.32,molestie hendrerit at vulputate vitae nisl aenean lectus pellentesque eget nunc donec quis orci eget orci vehicula condimentum curabitur in
248,nam congue risus semper porta volutpat quam pede lobortis ligula sit amet eleifend pede libero quis orci nullam molestie nibh,"Donec vitae nisi. Nam ultrices, libero non mattis pulvinar, nulla pede ullamcorper augue, a suscipit nulla elit ac nulla. Sed vel enim sit amet nunc viverra dapibus.",beauty,171.57,768,Devpoint,Indigo,61.79,nibh quisque id justo sit amet sapien dignissim vestibulum vestibulum ante ipsum primis in faucibus orci
249,morbi ut odio cras mi pede malesuada in imperdiet et commodo vulputate justo in blandit,"Sed ante. Vivamus tortor. Duis mattis egestas metus. Aenean fermentum. Donec ut mauris eget massa tempor convallis. Nulla neque libero, convallis eget, eleifend luctus, ultricies eu, nibh. Quisque id justo sit amet sapien dignissim vestibulum.",clothing,560.8,66,Pixoboo,Orange,78.09,in faucibus orci luctus et ultrices posuere cubilia curae nulla dapibus dolor vel est donec odio justo sollicitudin ut suscipit
250,aliquam convallis nunc proin at turpis a pede posuere nonummy integer,"Mauris sit amet eros. Suspendisse accumsan tortor quis turpis. Sed ante. Vivamus tortor. Duis mattis egestas metus. Aenean fermentum. Donec ut mauris eget massa tempor convallis. Nulla neque libero, convallis eget, eleifend luctus, ultricies eu, nibh.",clothing,827.99,833,Mybuzz,Pink,7.18,eget elit sodales scelerisque mauris sit amet eros suspendisse accumsan tortor quis turpis sed ante vivamus tortor duis mattis
251,etiam faucibus cursus urna ut tellus nulla ut erat id mauris vulputate,"Vestibulum ante ipsum primis in faucibus orci luctus et ultrices posuere cubilia Curae; Mauris viverra diam vitae quam. Suspendisse potenti. Nullam porttitor lacus at turpis. Donec posuere metus vitae ipsum. Aliquam non mauris. Morbi non lectus. Aliquam sit amet diam in magna bibendum imperdiet. Nullam orci pede, venenatis non, sodales sed, tincidunt eu, felis. Fusce posuere felis sed lacus. Morbi sem mauris, laoreet ut, rhoncus aliquet, pulvinar sed, nisl.",electronics,766.51,46,Agivu,Fuscia,33.59,duis bibendum felis sed interdum venenatis turpis enim blandit mi in porttitor pede justo eu
252,posuere metus vitae ipsum aliquam non mauris morbi non lectus aliquam sit amet,"Suspendisse ornare consequat lectus. In est risus, auctor sed, tristique in, tempus sit amet, sem. Fusce consequat. Nulla nisl. Nunc nisl. Duis bibendum, felis sed interdum venenatis, turpis enim blandit mi, in porttitor pede justo eu massa. Donec dapibus. Duis at velit eu est congue elementum. In hac habitasse platea dictumst.",beauty,172.4,809,Flashspan,Khaki,38.89,mauris enim leo rhoncus sed vestibulum sit amet cursus id turpis integer aliquet massa id lobortis convallis tortor risus dapibus
253,non sodales sed tincidunt eu felis fusce posuere felis sed lacus morbi,"Vestibulum sed magna at nunc commodo placerat. Praesent blandit. Nam nulla. Integer pede justo, lacinia eget, tincidunt eget, tempus vel, pede. Morbi porttitor lorem id ligula. Suspendisse ornare consequat lectus. In est risus, auctor sed, tristique in, tempus sit amet, sem. Fusce consequat. Nulla nisl. Nunc nisl.",clothing,506.77,795,Yamia,Crimson,83.58,convallis morbi odio odio elementum eu interdum eu tincidunt in leo maecenas
254,maecenas tincidunt lacus at velit vivamus vel nulla eget eros elementum pellentesque quisque porta volutpat erat quisque erat eros viverra,Ut at dolor quis odio consequat varius. Integer ac leo. Pellentesque ultrices mattis odio.,beauty,336.87,769,Thoughtmix,Orange,33.07,pellentesque at nulla suspendisse potenti cras in purus eu magna
255,viverra eget congue eget semper rutrum nulla nunc purus phasellus in felis donec semper sapien a,"Proin interdum mauris non ligula pellentesque ultrices. Phasellus id sapien in sapien iaculis congue. Vivamus metus arcu, adipiscing molestie, hendrerit at, vulputate vitae, nisl. Aenean lectus. Pellentesque eget nunc. Donec quis orci eget orci vehicula condimentum. Curabitur in libero ut massa volutpat convallis.",home goods,858.83,26,Skidoo,Khaki,56.46,condimentum neque sapien placerat ante nulla justo aliquam quis turpis eget elit sodales scelerisque
256,semper porta volutpat quam pede lobortis ligula sit amet eleifend pede libero quis orci nullam molestie,"Aliquam non mauris. Morbi non lectus. Aliquam sit amet diam in magna bibendum imperdiet. Nullam orci pede, venenatis non, sodales sed, tincidunt eu, felis. Fusce posuere felis sed lacus. Morbi sem mauris, laoreet ut, rhoncus aliquet, pulvinar sed, nisl. Nunc rhoncus dui vel sem.",electronics,289.54,122,Lazzy,Purple,63.54,quis tortor id nulla ultrices aliquet maecenas leo odio condimentum id luctus nec molestie
257,id justo sit amet sapien dignissim vestibulum vestibulum ante ipsum primis,Nulla tempus. Vivamus in felis eu sapien cursus vestibulum. Proin eu mi.,electronics,283.56,641,Meembee,Yellow,16.53,imperdiet et commodo vulputate justo in blandit ultrices enim lorem ipsum dolor sit amet consectetuer adipiscing elit
258,amet eleifend pede libero quis orci nullam molestie nibh in lectus pellentesque at nulla,Aenean sit amet justo.,home goods,513.67,442,Twitterlist,Yellow,10.94,sed lacus morbi sem mauris laoreet ut rhoncus aliquet pulvinar sed nisl nunc rhoncus dui
259,mauris lacinia sapien quis libero nullam sit amet turpis elementum ligula vehicula consequat,Aenean lectus. Pellentesque eget nunc.,toys,10.78,609,Agimba,Indigo,39.04,id ligula suspendisse ornare consequat lectus in est risus auctor sed tristique in tempus sit amet sem fusce consequat nulla
260,quis turpis sed ante vivamus tortor duis mattis egestas metus,"Suspendisse potenti. Cras in purus eu magna vulputate luctus. Cum sociis natoque penatibus et magnis dis parturient montes, nascetur ridiculus mus.",toys,480.71,53,Layo,Mauv,28.96,vehicula consequat morbi a ipsum integer a nibh in quis justo maecenas rhoncus aliquam lacus morbi
261,vulputate ut ultrices vel augue vestibulum ante ipsum primis in,"Cum sociis natoque penatibus et magnis dis parturient montes, nascetur ridiculus mus. Etiam vel augue. Vestibulum rutrum rutrum neque. Aenean auctor gravida sem. Praesent id massa id nisl venenatis lacinia.",home goods,862.38,478,Devcast,Yellow,33.36,dictumst aliquam augue quam sollicitudin vitae consectetuer eget rutrum at lorem integer tincidunt ante vel
262,purus aliquet at feugiat non pretium quis lectus suspendisse potenti in eleifend quam a odio,"Phasellus sit amet erat. Nulla tempus. Vivamus in felis eu sapien cursus vestibulum. Proin eu mi. Nulla ac enim. In tempor, turpis nec euismod scelerisque, quam turpis adipiscing lorem, vitae mattis nibh ligula nec sem. Duis aliquam convallis nunc. Proin at turpis a pede posuere nonummy. Integer non velit. Donec diam neque, vestibulum eget, vulputate ut, ultrices vel, augue.",toys,519.04,595,Photobean,Turquoise,39.15,nunc commodo placerat praesent blandit nam nulla integer pede justo lacinia eget tincidunt eget tempus
263,magna vestibulum aliquet ultrices erat tortor sollicitudin mi sit amet,"Vestibulum quam sapien, varius ut, blandit non, interdum in, ante. Vestibulum ante ipsum primis in faucibus orci luctus et ultrices posuere cubilia Curae; Duis faucibus accumsan odio. Curabitur convallis. Duis consequat dui nec nisi volutpat eleifend.",electronics,97.46,599,Tazzy,Yellow,17.49,vehicula condimentum curabitur in libero ut massa volutpat convallis morbi odio odio
264,lectus vestibulum quam sapien varius ut blandit non interdum in ante,"Curabitur in libero ut massa volutpat convallis. Morbi odio odio, elementum eu, interdum eu, tincidunt in, leo. Maecenas pulvinar lobortis est. Phasellus sit amet erat. Nulla tempus. Vivamus in felis eu sapien cursus vestibulum.",toys,506.18,750,Dabfeed,Green,0.56,dolor quis odio consequat varius integer ac leo pellentesque ultrices mattis odio
265,praesent id massa id nisl venenatis lacinia aenean sit amet justo morbi ut odio cras mi pede malesuada in imperdiet,Aliquam non mauris. Morbi non lectus.,beauty,931.19,545,Brightbean,Puce,27.94,sed interdum venenatis turpis enim blandit mi in porttitor pede justo eu massa donec dapibus duis at velit
266,congue vivamus metus arcu adipiscing molestie hendrerit at vulputate vitae nisl,"Phasellus in felis. Donec semper sapien a libero. Nam dui. Proin leo odio, porttitor id, consequat in, consequat ut, nulla. Sed accumsan felis. Ut at dolor quis odio consequat varius. Integer ac leo. Pellentesque ultrices mattis odio. Donec vitae nisi.",beauty,879.48,321,Meevee,Mauv,84.72,nibh fusce lacus purus aliquet at feugiat non pretium quis lectus
267,posuere cubilia curae duis faucibus accumsan odio curabitur convallis duis consequat dui nec nisi volutpat eleifend,"Integer non velit. Donec diam neque, vestibulum eget, vulputate ut, ultrices vel, augue.",beauty,430.71,266,Cogidoo,Green,57.63,lacinia aenean sit amet justo morbi ut odio cras mi pede malesuada
268,ac enim in tempor turpis nec euismod scelerisque quam turpis adipiscing lorem vitae mattis nibh ligula nec sem duis,"Nulla ut erat id mauris vulputate elementum. Nullam varius. Nulla facilisi. Cras non velit nec nisi vulputate nonummy. Maecenas tincidunt lacus at velit. Vivamus vel nulla eget eros elementum pellentesque. Quisque porta volutpat erat. Quisque erat eros, viverra eget, congue eget, semper rutrum, nulla. Nunc purus. Phasellus in felis.",beauty,387.51,55,Trudoo,Purple,48.99,orci eget orci vehicula condimentum curabitur in libero ut massa volutpat convallis morbi odio odio
269,porttitor lacus at turpis donec posuere metus vitae ipsum aliquam non,"Nam congue, risus semper porta volutpat, quam pede lobortis ligula, sit amet eleifend pede libero quis orci. Nullam molestie nibh in lectus. Pellentesque at nulla. Suspendisse potenti. Cras in purus eu magna vulputate luctus. Cum sociis natoque penatibus et magnis dis parturient montes, nascetur ridiculus mus. Vivamus vestibulum sagittis sapien. Cum sociis natoque penatibus et magnis dis parturient montes, nascetur ridiculus mus. Etiam vel augue. Vestibulum rutrum rutrum neque.",electronics,404.88,69,Jayo,Indigo,81.29,interdum in ante vestibulum ante ipsum primis in faucibus orci luctus et ultrices posuere
270,dapibus augue vel accumsan tellus nisi eu orci mauris lacinia sapien quis libero nullam sit,"Morbi a ipsum. Integer a nibh. In quis justo. Maecenas rhoncus aliquam lacus. Morbi quis tortor id nulla ultrices aliquet. Maecenas leo odio, condimentum id, luctus nec, molestie sed, justo. Pellentesque viverra pede ac diam. Cras pellentesque volutpat dui. Maecenas tristique, est et tempus semper, est quam pharetra magna, ac consequat metus sapien ut nunc.",clothing,295.54,343,Dablist,Purple,92.4,hac habitasse platea dictumst etiam faucibus cursus urna ut tellus nulla ut erat id mauris vulputate elementum nullam
